job_title,specialization,required_skills,future_career_projection,difficulty,detailed_overview,learning_roadmap,related_careers,time_to_master,tools_used
Blockchain Smart Contract Auditor,Software,"Solidity, Security, Ethereum, Math, Testing",High Niche (+35%),High,Review smart contract code to find critical security flaws and economic vulnerabilities before deployment.,1. Blockchain Core Theory|2. Advanced Solidity Programming|3. Common Web3 Attack Vectors|4. Static Analysis Tools (Slither)|5. Fuzzing & Symbolic Execution|6. Formal Verification Basics|7. Economic/Game Theory Auditing|8. Technical Audit Report Writing,"Blockchain Dev, Security Researcher, Web3 Lead",18-30 Months,"Slither, Mythril, Hardhat, Echidna"
API Documentation Engineer,Software,"Markdown, OpenAPI, Technical Writing, REST",Steady Growth (+10%),Low,Write and manage the technical documentation that allows developers to integrate with software APIs.,1. Understanding API Paradigms|2. OpenAPI/Swagger Specification|3. Technical Writing for Developers|4. Markdown & Static Site Generators|5. Docs-as-Code Workflows (Git)|6. Code Snippet Generation (Py/JS)|7. Information Architecture|8. Developer Experience (DX) Testing,"Technical Writer, Product Manager, Developer Advocate",6-12 Months,"Postman, Swagger, Docusaurus, GitHub"
Mobile QA Automation,Software,"Appium, Swift/Kotlin, Testing, CI/CD",High Growth (+18%),Medium,Specialize in automating the testing of mobile applications across various device models and OS versions.,1. Mobile OS Architecture Basics|2. Manual Mobile Testing Techniques|3. Appium Automation Framework|4. UI Automator & XCUITest|5. Mobile Device Cloud (SauceLabs)|6. Performance & Battery Testing|7. CI/CD for Mobile Apps|8. Automated Bug Reporting Flows,"QA Automation, Mobile Developer, SDET",12-18 Months,"Appium, Bitrise, Xcode, Android Studio"
Performance Software Engineer,Software,"C++, Profiling, Benchmarking, OS, Memory",Niche High Growth (+15%),High,"Optimize code to reduce latency and memory usage, focusing on the most critical paths of an application.",1. Computer Architecture Fundamentals|2. Memory Hierarchy & Caching|3. Profiling Tools (Perf/Valgrind)|4. Benchmark Design & Statistics|5. Algorithmic Complexity Analysis|6. Multi-threading & Concurrency|7. Compiler Optimization Flags|8. OS-level Performance Tuning,"Backend Developer, SRE, Kernel Developer",18-30 Months,"Valgrind, GPROF, C++, Python"
Application Security Engineer,Networks,"OWASP, SAST/DAST, Code Review, Web Security",Very High Growth (+28%),High,Ensure that software applications are secure by reviewing code and implementing defensive security controls.,1. Web Application Security (OWASP)|2. Secure Coding Best Practices|3. Static/Dynamic Analysis (SAST/DAST)|4. Threat Modeling for Apps|5. Vulnerability Remediation|6. Identity & Auth (OAuth/OIDC)|7. API Security Standards|8. Secure SDLC Integration,"Security Analyst, Backend Developer, Pentester",18-30 Months,"Snyk, Checkmarx, Burp Suite, SonarQube"
Technical Virtual Assistant (Launch Focus),Online Support,"Landing Pages, Email, GTM, WordPress, Analytics",Steady (Gig Economy Focus),Low,"Manage the technical execution of a product launch, including funnel setup, automation, and live support.",1. Marketing Funnel Strategy|2. Landing Page Builders (Webflow)|3. Email Automation Sequencing|4. Checkout & Payment Integrations|5. Webinar Platform Technical Setup|6. Analytics Tracking (GTM)|7. Customer Support during Launch|8. Post-launch Data Reporting,"Marketing Ops, Project Manager, Operations Lead",6-12 Months,"Webflow, ConvertKit, Stripe, GTM"
Help Desk Lead (Technical),Online Support,"Leadership, Ticketing, Process, Troubleshooting",Stable Growth (+7%),Medium,"Manage a team of technical support reps, defining workflows and handling the most difficult escalations.",1. Advanced Troubleshooting Flow|2. Help Desk Performance Metrics|3. Team Coaching & Mentorship|4. Knowledge Base (Wiki) Management|5. SLA & KPI Design|6. Customer Satisfaction Analytics|7. Support Process Automation|8. Cross-departmental Liaison,"Systems Admin, Support Manager, IT Director",12-24 Months,"Jira Service Management, Zendesk, Excel"
Cloud Migration Support,Software,"Cloud, Data Transfer, Troubleshooting, Linux",High Growth (+20%),Medium,Provide technical support to companies moving their local data and apps into the cloud.,1. On-prem vs Cloud Infrastructure|2. Data Transfer Tooling (DMS)|3. Networking & Firewall Config|4. Application Connectivity Testing|5. Database Migration Basics|6. Post-migration Troubleshooting|7. Cloud Cost Monitoring Setup|8. Migration Documentation Writing,"Cloud Engineer, Solutions Architect, IT Manager",12-18 Months,"AWS Migration Hub, Azure Migrate"
Technical Moderator (Forum/Community),Online Services,"Community, Technical Knowledge, Git, Documentation",Evolving (+10%),Low,"Moderate technical communities (like StackOverflow or GitHub) to ensure high-quality, safe technical discussion.",1. Technical Domain Knowledge|2. Community Management Standards|3. Markdown & Formatting Basics|4. Conflict Resolution Tech|5. Flagging & Reporting Systems|6. Automated Bot Management|7. User Reputation System Logic|8. Data Privacy & Safety Ethics,"Technical Writer, Developer Advocate, Community Mgr",6-12 Months,"GitHub, Discord, Slack, Discourse"
WordPress Technical Specialist,Online Services,"PHP, JavaScript, CSS, SQL, Servers",Steady (+5%),Medium,"Focus on the complex side of WordPress: custom plugins, database optimization, and server performance.",1. WordPress Core Architecture|2. Custom Theme Dev (PHP/JS)|3. Plugin Development Patterns|4. Database Management (SQL)|5. Performance Tuning (Caching)|6. WP-CLI & Automation|7. Security Hardening for WP|8. Migrating Large WP Sites,"Web Developer, Web Admin, Backend Dev",12-18 Months,"PHP, LocalWP, SQL, Git"
Technical Recruiter (IT/Online),Online Services,"IT Literacy, Sourcing, Screening, ATS",Steady/High Growth (+15%),Low,"Identify and hire for online tech roles like Support, QA, and VAs by understanding their specific tech toolsets.",1. IT & Online Role Mapping|2. Tool-based Keyword Sourcing|3. Screening Technical Skills|4. Remote Interview Process Design|5. Compensation Benchmarking|6. Talent Pipeline Management|7. Recruiting Data Analytics|8. Onboarding Coordination,"HR Generalist, Talent Lead, Sourcing Specialist",6-12 Months,"LinkedIn, Greenhouse, Lever"
IT Asset Management Specialist,Online Services,"Inventory, SQL, Licensing, Compliance",Steady Growth (+8%),Low,"Maintain the technical inventory of all company computers, software licenses, and cloud seats.",1. IT Asset Lifecycle Theory|2. Software Licensing Models|3. Inventory Database Management|4. Procurement Flow Automation|5. Regulatory Compliance Basics|6. Hardware Disposal Standards|7. Cost Optimization Analytics|8. Asset Management Tool Admin,"Systems Admin, Procurement Specialist, IT Auditor",6-12 Months,"ServiceNow, Flexera, Excel"
Technical Project Coordinator (Software),Software,"Jira, Scheduling, SDLC, Communication",Growing (+12%),Low,"Support software project managers by tracking tasks, managing documentation, and coordinating meetings.",1. Software Dev Lifecycle (SDLC)|2. Project Tracking (Jira/Asana)|3. Meeting Facilitation & Notes|4. Task Dependency Mapping|5. Resource Availability Tracking|6. Technical Status Reporting|7. Risk Documentation Basics|8. Project Closure Workflows,"Project Manager, Scrum Master, Business Analyst",6-12 Months,"Jira, Confluence, Trello"
Product Marketing Associate (Tech),Software,"Technical Writing, Positioning, Marketing",Steady Growth (+10%),Low,Create the technical content and market research needed to sell complex software products.,1. Product Positioning Basics|2. Technical Audience Personas|3. Competitor Technical Analysis|4. Writing Decks & Blog Posts|5. Demo Environment Assistance|6. Marketing Analytics Basics|7. Cross-functional Coordination|8. Launch Plan Support,"Product Marketing Manager, Technical Writer",6-12 Months,"PowerPoint, Google Analytics, Notion"
Localization QA Engineer,Software,"Testing, i18n, l10n, Language Tech",Stable (+6%),Medium,"Test software versions for different countries to ensure language, time, and currency formats are correct.",1. Software Testing Foundations|2. i18n/l10n Technical Basics|3. Screen Reader & Font Testing|4. Cultural Context Validation|5. Bug Tracking for Languages|6. Scripting for Test Automation|7. Globalization Mgmt Systems|8. Regional Regulation Compliance,"QA Engineer, Localization Lead, Language Tech",12-18 Months,"XTM, Jira, Python"
Accessibility (A11y) Specialist,Software,"WCAG, Screen Readers, ARIA, HTML",High Growth (Regulatory driven),Medium,"Audit and improve software to ensure it is usable by people with disabilities (vision, hearing, motor).",1. Assistive Technology Mastery|2. WCAG Standard (A/AA/AAA)|3. Semantic HTML & ARIA|4. Accessibility Auditing Logic|5. Screen Reader Testing (NVDA)|6. Inclusive Design Principles|7. Automated A11y Tools|8. Team Training & Culture Change,"UI/UX Designer, Frontend Developer, QA Engineer",12-24 Months,"Axe, Lighthouse, NVDA, JAWS"
Technical Virtual Assistant (Data focus),Online Support,"SQL, Excel, Data Cleaning, APIs, Dashboards",Growing (+18%),Medium,"A VA specializing in data-heavy tasks: cleaning lead lists, building simple dashboards, and syncing databases.",1. Advanced Spreadsheet Logic|2. SQL for Data Cleaning|3. Data Hygiene Principles|4. Web Scraping & Data Extraction|5. API Data Sync (Zapier/Make)|6. Basic Data Visualization|7. Data Privacy (GDPR) Basics|8. Automated Reporting Workflows,"Data Analyst, Business Analyst, Operations Manager",12-18 Months,"SQL, Excel, Airtable, Zapier"
Site Reliability Engineer (Security),Infrastructure,"Secure CI/CD, Zero-Trust, Vault, Monitoring",Hyper Growth (+35%),High,Combine security and reliability by building infrastructure that is both stable and highly protected.,1. SRE Core Principles|2. Security Monitoring Automation|3. Secure Identity Management|4. Incident Command for Security|5. Hardening Distributed Systems|6. Secure CI/CD Pipelines|7. Zero-Trust Implementation|8. Reliability-focused Threat Model,"Security Engineer, SRE, Cloud Architect",24-36 Months,"Prometheus, HashiCorp Vault, AWS"
Database Security Engineer,Networks,"Guardium, Masking, Encryption, Access Control",High Demand (+22%),High,"Specialize in securing database systems, focusing on access control, encryption, and auditing.",1. Database Internals (MySQL/Postgres)|2. Data Classification & Discovery|3. Advanced Access Control (RBAC)|4. Data Encryption at Rest/Transit|5. Database Activity Monitoring (DAM)|6. Masking & Tokenization|7. Security Compliance Auditing|8. Hardening Database Configurations,"Database Admin, Security Architect, Data Analyst",18-30 Months,"Oracle, SQL Server, Guardium"
Cloud Cost Optimization Specialist,Infrastructure,"FinOps, Cost Explorer, Billing Analysis",Rapid Expansion (+25%),Low,Analyze cloud bills to identify waste and implement cost-saving strategies for tech companies.,1. Cloud Pricing Architectures|2. Cost Allocation & Tagging|3. Rightsizing & Scaling Strategies|4. Spot Instance & Savings Plans|5. FinOps Principles & Lifecycle|6. Cloud Billing Analysis Tools|7. Cost Governance & Policies|8. Reporting & Executive Dashboards,"Cloud Architect, IT Manager, Financial Analyst",6-12 Months,"AWS Cost Explorer, Azure Cost Management"
Network Security Engineer,Networks,"Palo Alto, Fortinet, SSL Inspection, Segment",Very High Growth (+28%),High,Protect computer networks from unauthorized access and cyberattacks using firewalls and monitoring.,1. Perimeter Security (Firewalls)|2. VPN & Secure Remote Access|3. IDS/IPS Signature Management|4. Network Segmentation Design|5. Endpoint Protection Integration|6. DDoS Mitigation Strategies|7. SSL/TLS Inspection|8. Network Access Control (NAC),"Cybersecurity Analyst, Network Architect, SRE",18-30 Months,"Palo Alto, Cisco, Fortinet"
Data Warehouse Architect,Data Science,"Snowflake, Redshift, Dimensional Modeling, dbt",High Growth (+20%),High,Design and build centralized data storage systems optimized for reporting and analysis across an entire organization.,1. Star & Snowflake Schemas|2. ELT/ETL Pipeline Architecture|3. MPP Database Internals|4. Data Integration Frameworks|5. Metadata Management & Lineage|6. Scalable Storage Design|7. Performance Tuning for BI|8. Data Governance & Security,"Data Engineer, BI Architect, Data Architect",24-36 Months,"Snowflake, Redshift, BigQuery, dbt"
Hardware Release Manager,Hardware,"Release, PLM, Documentation, ECO, Process",Steady (+10%),Medium,Coordinate the final documentation and approval process (ECOs) to officially release a hardware design.,1. Hardware Development Gates|2. PLM System Management|3. Engineering Change Order (ECO)|4. Documentation Standards|5. BOM Validation & Accuracy|6. Release Checkpoint Orchestration|7. Cross-functional Sign-off|8. Process Improvement for Release,"Program Manager, Operations, Hardware Lead",18-30 Months,"Arena PLM, Windchill, Excel"
Growth Marketing Engineer,Software,"A/B Testing, Python, Marketing APIs, Frontend",Growing (+18%),Medium,A software engineer who works directly within the marketing team to build landing pages and experiments.,1. Marketing Attribution Tech|2. High-converting UI Design|3. Experiment Implementation|4. Marketing Tooling APIs|5. Tracking & Tag Management|6. SEO Technical Optimization|7. Rapid Prototyping (Web)|8. Data-driven Iteration Flow,"Growth Engineer, Frontend Developer, Marketing",18-30 Months,"React, Python, GTM, Optimizely"
Multimedia Pipeline Architect,Software,"Pipelines, Cloud, Scaling, Media, Infrastructure",High Demand (+15%),High,Design the end-to-end technical software pipeline for large-scale media production and distribution.,1. Production Workflow Analysis|2. Cloud Media Storage Design|3. Transcoding Orchestration|4. Media Metadata Architecture|5. Pipeline Security & Rights|6. API Design for Multimedia|7. Scalable Asset Delivery|8. Long-term Media Tech Strategy,"CTO, Multimedia Engineer, Systems Architect",36-60 Months,"AWS, FFmpeg, Python, Visio"
Thermal Mechanical Engineer,Hardware,"Heat Transfer, CFD, Mechanical Design, CAD",Growing (+12%),High,Combine mechanical design and heat transfer analysis to create physical enclosures with optimized cooling.,1. Heat Transfer (Conduction/Convection)|2. Mechanical CAD Design|3. Thermal Interface Materials|4. Computational Fluid Dynamics|5. Heatsink & Cold Plate Design|6. Material Stress & Fatigue|7. Manufacturing for Cooling|8. Thermal Reliability Testing,"Thermal Management Engineer, Mechanical Eng, Hardware",24-36 Months,"SolidWorks, ANSYS Icepak, FloTHERM"
High-Speed Board Design Engineer,Hardware,"DDR4/5, PCIe, SerDes, Impedance Control, Simulation",Critical Growth (+25%),Very High,Specialize in PCB designs with extremely fast data rates where physical trace geometry affects signal timing.,1. Transmission Line Theory|2. Differential Pair Routing|3. Timing Budget Analysis|4. Crosstalk & Jitter Mitigation|5. Power Integrity Simulation|6. SerDes & Protocol Layout (PCIe)|7. Layer Stackup Optimization|8. Signal Integrity Validation,"Signal Integrity Engineer, PCB Designer, Hardware Lead",24-36 Months,"HyperLynx, Sigrity, Altium Designer"
Battery Management Systems (BMS) Engineer,Hardware,"Lithium-Ion, Cell Balancing, State of Charge, Safety",Explosive Growth (+35%),High,Design the electronics and logic that manage battery packs in electric vehicles and mobile devices.,1. Battery Chemistry & Physics|2. Voltage & Current Sensing|3. Passive & Active Cell Balancing|4. State of Charge (SoC) Estimation|5. Thermal Protection Circuits|6. BMS Communication (CAN bus)|7. Safety Standards (ISO 26262)|8. BMS Firmware Development,"Power Electronics Engineer, EV Engineer, Hardware Lead",18-30 Months,"MATLAB/Simulink, CANalyzer, Electronic Loads"
Motor Control Engineer,Hardware,"FOC, BLDC Motors, Inverters, Control Theory, PWM",Steady Growth (+15%),High,Design the hardware and control algorithms for driving electric motors in robotics and EVs.,1. Electromagnetics & Motors|2. Power Inverter Topologies|3. Pulse Width Modulation (PWM)|4. Field Oriented Control (FOC)|5. Encoder & Hall Effect Sensing|6. Control Loop Tuning (PI/PID)|7. Real-time Interrupt Handling|8. EMI Mitigation for Drives,"Robotics Engineer, Hardware Engineer, Mechatronics",18-24 Months,"MATLAB/Simulink, Oscilloscopes, Motor Dynos"
Signal Integrity Test Engineer,Hardware,"Oscilloscopes, TDR, VNA, Eye Diagrams, Lab",High Growth (+18%),High,Perform hands-on lab measurements to verify the signal integrity models against real hardware prototypes.,1. Lab Instrumentation Safety|2. Probe Loading Effects|3. Time Domain Reflectometry (TDR)|4. Vector Network Analysis (VNA)|5. Eye Diagram Measurement|6. Bit Error Rate (BER) Testing|7. Jitter Decomposition|8. Correlating Simulation with Silicon,"Signal Integrity Engineer, HW Test Engineer",12-24 Months,"Keysight VNA, Tektronix Scope, PLTS"
Hardware Reliability Test Tech,Hardware,"Testing, Lab Gear, Environmental, Debugging",Steady (+10%),Low,"Set up and run the physical environmental tests (heat, vibration, drop) on hardware prototypes.",1. Lab Safety & Equipment Setup|2. Environmental Chamber Operation|3. Mechanical Drop/Vibe Testing|4. Data Logger Configuration|5. Basic Circuit Debugging|6. Test Log Documentation|7. Measurement Tool Calibration|8. Failure Reporting Basics,"Reliability Tech, Test Tech, Lab Manager",6-12 Months,"Oscilloscopes, Data Loggers, Lab Gear"
Hardware Compliance Specialist,Hardware,"Regulatory, Testing, Standards, Documentation",Steady/High (+15%),Medium,"Manage the testing and paperwork required to get hardware products certified (FCC, CE, UL).",1. Global Regulatory Standards|2. Certification Test Plan Design|3. Test Lab Coordination|4. Compliance Documentation Mgmt|5. Labelling & User Manual Review|6. Post-market Compliance Audit|7. Regulatory Change Monitoring|8. Strategic Compliance Planning,"Compliance Engineer, Hardware Eng, Quality",12-24 Months,"Excel, Regulatory Databases"
Multimedia Broadcast Tech,Online Support,"Networking, Video, Audio, Troubleshooting",Evolving (+10%),Low,Provide on-the-ground technical support for broadcast equipment during live streaming events.,1. Broadcast Equipment Setup|2. Signal Routing & Testing|3. Audio/Video Cabling (SDI/XLR)|4. Basic IP Networking|5. Live Streaming Software (OBS)|6. Real-time Troubleshooting|7. Equipment Maintenance|8. Technical Support Soft Skills,"Multimedia Tech, IT Support, Broadcast Engineer",6-12 Months,"OBS, Multimeters, Cabling Tools"
Technical Sourcing Associate (Recruiting),Online Services,"Research, Sourcing, Technical Literacy, Support",High Demand (+18%),Low,An entry-level role focused on supporting sourcers by finding candidate contact info and cleaning talent data.,1. Basic Technical Keyword Search|2. Contact Identification Tools|3. CRM Data Entry & Hygiene|4. Sourcing Workflow Basics|5. Team Support & Coordination|6. Candidate Research Foundations|7. Basic Reporting|8. Technical Role Awareness,"Sourcer, HR Assistant, Recruiting Support",3-9 Months,"LinkedIn, Excel, Gem"
IT Procurement Associate,Online Support,"Purchasing, Inventory, Vendors, Excel",Stable (+6%),Low,Handle the day-to-ground technical support for broadcast equipment during live streaming events.,1. Purchasing Workflow Basics|2. Purchase Order (PO) Creation|3. Inventory Asset Tracking|4. Shipping & Logistics Basics|5. Basic Vendor Communication|6. Invoice Reconciliation|7. Procurement Data Entry|8. Customer Service for IT,"Procurement Specialist, Asset Manager, Buyer",6-12 Months,"Oracle, Excel, Slack"
Agritech Field Technician,Hardware,"Hardware, Troubleshooting, Ag-tech, Field Work",Emerging (+20%),Low,"The 'boots on the ground' who install, calibrate, and repair smart farming hardware in the field.",1. Agricultural Hardware Basics|2. Field Installation Procedures|3. Sensor Calibration Logic|4. Real-time Troubleshooting|5. Wireless Networking Basics|6. Technical Documentation|7. Equipment Maintenance|8. Soft Skills for Farmers,"IT Support, Hardware Tech, IoT Tech",6-12 Months,"Multimeters, Hand Tools, Smartphone Apps"
Technical Support Representative (L3),Online Support,"Deep Diagnostics, Kernel, Log Analysis, Debugging",High Demand (+22%),High,"The highest tier of customer support, dealing with product bugs that require code-level investigation.",1. Deep Application Diagnostics|2. Kernel & OS Log Analysis|3. Code Debugging Basics|4. Advanced Network Packet Inspection|5. Database Deadlock Analysis|6. Interfacing with Dev Teams|7. Root Cause Analysis Reporting|8. Technical Knowledge Base Authoring,"Backend Developer, SRE, Systems Admin",18-30 Months,"GDB, Wireshark, SQL Profiler, Linux Kernel Logs"
Technical Virtual Assistant (Web Focus),Online Support,"WordPress, CSS, Elementor, Analytics, Speed",Steady (+12%),Medium,"A VA specializing in keeping websites running smoothly, focusing on speed, updates, and minor CSS fixes.",1. WordPress Theme Hierarchy|2. CSS for UI Customization|3. Page Speed Optimization (Caching)|4. Malware Scanning & Removal|5. Domain & DNS Management|6. SEO Plugin Configuration|7. CDN Setup (Cloudflare)|8. Website Backup & Migration,"Web Admin, Frontend Dev, SEO Tech",12-18 Months,"WordPress, Elementor, PageSpeed Insights"
Customer Success Associate (Onboarding),Online Support,"Communication, Onboarding, Product knowledge",Stable/High (+15%),Low,Help new technical customers get their initial setup and configuration completed correctly.,1. Customer Onboarding Workflow|2. Product Configuration Basics|3. Technical Training Skills|4. Account Health Monitoring|5. Customer Relationship Mgmt|6. Project Coordination|7. Support Ticket Facilitation|8. Initial Success Metrics,"CSM, Implementation Specialist, Support",6-12 Months,"Salesforce, Zoom, Slack"
Technical Customer Success Manager,Online Support,"Relationship, Tech Advocacy, APIs, Strategy",Rapid Expansion (+25%),Medium,"Act as a technical advisor for key customers, helping them integrate and scale their use of a software product.",1. Advanced Product Architecture|2. Consultative Technical Selling|3. Integration Design (Webhooks/API)|4. Technical Account Reviews|5. Churn Prevention Analytics|6. Feature Roadmap Advocacy|7. Stakeholder Influence Skills|8. Strategic Success Planning,"Solutions Architect, Product Manager, Account Exec",18-30 Months,"Salesforce, Gainsight, Postman"
Implementation Specialist (Software),Online Support,"Configuration, Training, SQL, Project Mgmt",Steady (+10%),Medium,Manage the end-to-end technical implementation of software for new enterprise clients.,1. Software Implementation Framework|2. Client Requirement Gathering|3. Custom Configuration & Logic|4. SQL for Initial Data Migration|5. End-user Technical Training|6. Acceptance Testing (UAT) Flows|7. Project Timeline Management|8. Handoff to Support Support,"Solutions Engineer, Project Manager, CS Manager",12-24 Months,"SQL, Jira, Excel, Zoom"
Technical Chat Support Specialist,Online Support,"Fast Typing, Multi-tasking, Basic Troubleshooting",Stable (+5%),Low,"Provide real-time technical help via chat, managing multiple conversations and resolving issues quickly.",1. High-speed Technical Typing|2. Multi-chat Management Logic|3. Knowledge Base Navigation|4. Remote Desktop Basics|5. Chat Etiquette & Branding|6. Basic OS & App Debugging|7. Screen Capture & Documentation|8. Escalation Triage Rules,"Technical Support L1, Community Manager",3-6 Months,"Intercom, LiveChat, Slack"
Remote Systems Support tech,Online Support,"Linux, SSH, Scripting, Troubleshooting",Stable Growth (+8%),Medium,"Manage and troubleshoot servers and systems remotely for clients, ensuring uptime and security.",1. SSH & Remote Terminal Basics|2. Linux OS Administration|3. Automated Update Systems|4. Remote Firewall Configuration|5. Server Log Monitoring|6. Bash Scripting for Maintenance|7. Security Hardening Basics|8. Remote Backup Verification,"Systems Admin, DevOps, Support L2",12-18 Months,"Bash, Putty, Nagios, Docker"
Virtual Assistant (Social Tech Focus),Online Services,"GTM, Pixels, Meta Ads, Analytics, Scheduling",Stable (+10%),Low,"Manage the technical side of social media: tracking pixels, ad account setup, and performance reporting.",1. Tracking Pixel Architecture|2. GTM Event Tagging|3. Social Media Ad Account Setup|4. UTM Link Strategy|5. Basic API Data Extraction|6. Analytics Dashboard Building|7. Social Tech Stack Integration|8. Automated Reporting Tools,"Marketing Ops, Social Media Manager, Data Analyst",6-12 Months,"GTM, Facebook Events Manager, Google Analytics"
E-commerce Platform Support,Online Support,"Shopify, API, Liquid, Troubleshooting",High Growth (+20%),Medium,"Specialized support for e-commerce store owners, dealing with theme errors, app conflicts, and checkout bugs.",1. Liquid Templating Language|2. E-commerce App Interoperability|3. Checkout Flow Troubleshooting|4. API Connection Debugging|5. Mobile Commerce Standards|6. Inventory Sync Logic|7. Payment Gateway Testing|8. App Security Auditing,"Web Dev, E-commerce Manager, Support Engineer",12-18 Months,"Shopify, Chrome DevTools, Postman"
SaaS Technical Support Rep,Online Support,"SaaS Architecture, APIs, Browser Diagnostics",High Growth (+18%),Medium,"Provide support specifically for Software-as-a-Service products, focusing on browser issues and API errors.",1. SaaS Delivery Models (Multi-tenant)|2. Browser Debugging (DevTools)|3. HTTP Status Code Mastery|4. API Testing (Postman)|5. Browser Extension Debugging|6. Cache & Cookie Impact Analysis|7. SSO & Login Troubleshooting|8. Feature Flag Awareness,"Support Engineer, Product Manager",6-12 Months,"Postman, Chrome DevTools, Splunk"
