job_title,specialization,required_skills,future_career_projection,difficulty,detailed_overview,learning_roadmap,related_careers,time_to_master,tools_used
Technical Sourcing Associate (Frontend focus),Online Services,"Sourcing, Frontend Stack, LinkedIn, Talent Tech",Growing (+12%),Low,"Identify and engage frontend engineering talent, understanding their specific framework and UI stacks.",1. Frontend Role Mapping|2. React/Vue Keyword Sourcing|3. UI/UX Skill Identification|4. Candidate Portfolio Review|5. Outreach for Frontend Roles|6. Sourcing Data Hygiene|7. Frontend Community Mapping|8. Market Skill Availability,"Sourcer, Tech Recruiter, HR Lead",6-12 Months,"LinkedIn, GitHub, Dribbble"
Remote Database Technical Support Specialist,Online Support,"SQL, Troubleshooting, Connectivity, Maintenance",Stable (+8%),Medium,"Provide specialized remote support for database systems, focusing on connectivity, errors, and basic maintenance.",1. Database Architecture Basics|2. Connectivity Debugging (ODBC)|3. SQL Error Log Investigation|4. Query Troubleshooting Basics|5. Security Permission Fixes|6. Backup Verification Support|7. Database Documentation Authoring|8. Handoff to DBA Teams,"Database Admin, Support L2, Data Analyst",12-24 Months,"SQL Server, MySQL, Postgres"
Cloud Infrastructure Support (L2),Online Support,"Cloud, Networking, Scripting, CLI, Diagnostics",Growing (+18%),High,Troubleshoot complex cloud server and network failures escalated from Level 1 support.,1. Advanced Cloud Networking|2. IAM Role Troubleshooting|3. Serverless Debugging basics|4. Database Migration Support|5. Hybrid Cloud Connectivity|6. Infrastructure-as-Code Auditing|7. Cost Anomaly Investigation|8. Cloud Security Forensics basics,"Cloud Architect, SRE, DevOps",18-30 Months,"AWS, Azure, Terraform, CloudWatch"
Embedded Systems Engineer,Hardware,"C, C++, RTOS, ARM Architecture, I2C/SPI, Oscilloscopes",High Growth (+18%),High,Work at the intersection of hardware and software. You'll write low-level code that directly controls physical devices.,1. Digital Logic & Circuit Theory|2. Advanced C Programming (Pointers/Memory)|3. Microcontroller Architectures (ARM/AVR)|4. Peripheral Interfacing (I2C/SPI/UART)|5. Interrupt Handling & Timers|6. Real-Time Operating Systems (RTOS)|7. Hardware Debugging with Oscilloscopes|8. Low-level Driver Development,"Firmware Engineer, Robotics Engineer, Hardware Architect",12-18 Months,"Oscilloscopes, JTAG Debuggers, Keil, Logic Analyzers"
Full Stack Developer,Software,"JavaScript, React, Node.js, SQL, Git, REST APIs, HTML/CSS",Rapid Expansion (+25%),Medium,"Build complete end-to-end web applications. You will manage the logic of the browser, the server, and the database.",1. Semantic HTML & Responsive CSS|2. JavaScript Fundamentals & DOM|3. Modern Frontend Frameworks (React/Vue)|4. State Management Patterns|5. Server-side Logic (Node/Python/Go)|6. Database Modeling & SQL|7. REST & GraphQL API Design|8. Authentication & Web Security,"Frontend Engineer, Backend Developer, Product Manager",6-12 Months,"VS Code, Docker, AWS, Git, Postman"
VLSI Design Engineer,Hardware,"Verilog, SystemVerilog, CMOS Design, Cadence Virtuoso, ASIC, FPGA",High Demand (+15%),Very High,Design the internal architecture of integrated circuits. You will work on shrinking billions of transistors into silicon chips.,1. Semiconductor Physics|2. Digital Systems Design|3. Verilog/SystemVerilog Coding|4. Logic Synthesis & Optimization|5. Physical Design (Floorplanning/Routing)|6. Static Timing Analysis (STA)|7. ASIC/FPGA Prototyping|8. Design for Testability (DFT),"ASIC Engineer, FPGA Engineer, Hardware Architect",24-36 Months,"Cadence Virtuoso, Vivado, ModelSim, Synopsys"
PCB Layout Engineer,Hardware,"Altium Designer, Allegro, DFM, High-speed Routing, Stackup",Steady Growth (+10%),Medium,"Translate circuit schematics into physical board designs, ensuring signal integrity and manufacturability.",1. Electrical Schematic Symbols|2. Footprint Creation & Libraries|3. Component Placement Strategy|4. Signal Integrity & Trace Routing|5. Power Plane & Grounding|6. Design for Manufacturing (DFM)|7. Gerber File Generation|8. PCB Assembly & Troubleshooting,"Hardware Design Engineer, Electronics Technician, Manufacturing Engineer",12-18 Months,"Altium Designer, Allegro, PADS, KiCad"
Technical Support Representative (L1),Online Support,"Troubleshooting, Windows/Mac OS, Ticketing, Communication",Stable (AI Augmentation),Low,"Provide initial technical assistance to customers, resolving common software issues and hardware setup problems.",1. Basic PC Hardware Anatomy|2. Operating System Navigation (Win/Mac)|3. Common Software Troubleshooting|4. Remote Desktop Tools Mastery|5. Ticketing Systems & Documentation|6. Basic Networking (IP/WiFi/DNS)|7. Customer Service Soft Skills|8. Escalation Workflow Management,"Technical Support L2, Systems Admin, Help Desk Lead",3-6 Months,"Zendesk, TeamViewer, Jira Service Desk"
Technical Support Engineer (L2),Online Support,"Active Directory, SQL, Networking, Logs, Linux",Growing Demand (+12%),Medium,"Deep-dive into complex technical issues escalated from L1, requiring server-side knowledge and database queries.",1. Advanced OS Diagnostics|2. Active Directory Management|3. SQL for Data Investigation|4. Network Traffic Analysis|5. Linux Terminal Mastery|6. Log Management & Analysis|7. Application Environment Debugging|8. Technical Documentation (SOPs),"Technical Support L3, Systems Admin, DevOps",6-12 Months,"Splunk, SQL Server, Wireshark, Putty"
Cloud Support Engineer,Software,"AWS/Azure, Linux, Networking, Scripting, CLI",Aggressive Growth (+28%),High,Help enterprise customers manage their cloud infrastructure and troubleshoot deployment failures in real-time.,1. Cloud Provider Core Services|2. Virtual Machine Management|3. VPC & Cloud Networking Security|4. IAM Roles & Permissions|5. Storage Solutions (S3/EBS)|6. CLI & SDK Fundamentals|7. Basic Serverless Troubleshooting|8. Cost Management & Governance,"DevOps Engineer, Cloud Architect, SRE",12-18 Months,"AWS Console, Azure Portal, Terraform, Bash"
Virtual Assistant (Technical focus),Online Support,"CRM, Excel, Automation, WordPress, Basic HTML",High Demand (Gig Economy),Low,"Manage the technical side of a business, including website updates, CRM data management, and workflow automation.",1. CRM Navigation & Data Hygiene|2. Email Marketing Automation Tools|3. CMS Management (WordPress)|4. Basic HTML/CSS for Web Tweaks|5. Spreadsheet Logic (VLookup/Pivot)|6. Project Management Tooling|7. Zapier/Make Workflow Automation|8. Virtual Communication Etiquette,"Operations Manager, Social Media Tech, Web Admin",6-12 Months,"Salesforce, Zapier, WordPress, Excel"
SEO Specialist (Technical),Online Services,"HTML, JavaScript, Crawling, Core Web Vitals, SQL",Evolving (AI-Search Focus),Medium,Focus on the backend technicalities that help search engines crawl and index websites more efficiently.,1. How Search Engines Crawl/Index|2. Semantic HTML & Schema Markup|3. Website Speed & Core Web Vitals|4. Robots.txt & Sitemap Management|5. Redirect & Link Equity Logic|6. JavaScript SEO & SPAs|7. Log File Analysis for SEO|8. Technical Auditing Frameworks,"Web Developer, Marketing Analyst, Data Analyst",6-18 Months,"Screaming Frog, Google Search Console, Ahrefs"
QA Manual Tester,Software,"Testing, Test Cases, Bug Reporting, SDLC",Transitioning to Automation,Low,Perform systematic tests on software to ensure it functions as intended and report defects to developers.,1. Software Development Lifecycle (SDLC)|2. Test Case Writing & Design|3. Black Box Testing Techniques|4. Bug Life Cycle & Documentation|5. Regression Testing Principles|6. Mobile App Testing Basics|7. Cross-browser Compatibility|8. Exploratory Testing Mindset,"QA Automation Engineer, Product Manager, Scrum Master",3-6 Months,"Jira, TestRail, Chrome DevTools"
QA Automation Engineer,Software,"Selenium, Python, Cypress, CI/CD, Scripting",High Growth (+22%),High,"Write scripts to automate repetitive tests, ensuring software stability through continuous integration.",1. Programming Fundamentals (Java/Py)|2. Selenium WebDriver Mastery|3. Page Object Model Design|4. API Testing with Postman|5. Framework Integration (TestNG/Pytest)|6. Continuous Integration (Jenkins)|7. Mobile Automation (Appium)|8. Load & Performance Testing,"SDET, DevOps Engineer, Software Engineer",12-24 Months,"Selenium, Pytest, Jenkins, GitHub Actions"
Backend Developer,Software,"Go, Python, Java, PostgreSQL, Redis, APIs, System Design",Very High Demand (+20%),High,"Build the server-side logic, database schemas, and APIs that power high-traffic applications.",1. Server-side Languages (Go/Python)|2. Database Schema Normalization|3. RESTful API Architecture|4. Middleware & Auth Implementation|5. Distributed Caching (Redis)|6. Message Queues (Kafka/RabbitMQ)|7. Microservices Design Patterns|8. Unit Testing & Load Balancing,"API Engineer, Software Architect, Database Admin",12-18 Months,"Node.js, PostgreSQL, Redis, Kafka, MongoDB"
Frontend Engineer,Software,"JavaScript, React, CSS, HTML, Webpack, Testing, Accessibility",Steady Demand (+15%),Medium,"Specialize in the user-facing part of web applications, focusing on performance, accessibility, and design fidelity.",1. Advanced CSS Layouts (Grid/Flex)|2. JavaScript ES6+ & Async Patterns|3. React/Vue Component Design|4. Performance Optimization & Bundling|5. Browser Rendering Engine Basics|6. Web Accessibility (WCAG)|7. Unit & Integration Testing|8. Design Systems Implementation,"UI/UX Designer, Full Stack Developer, Mobile Developer",6-12 Months,"Figma, Chrome DevTools, React, Storybook"
Mobile App Developer,Software,"Swift, Kotlin, React Native, Flutter, App Store, APIs",High Growth (+20%),Medium,Create high-performance mobile applications for iOS and Android using native or cross-platform frameworks.,1. Mobile UI/UX Design Patterns|2. Swift (iOS) or Kotlin (Android)|3. Mobile State Management|4. Networking & Local Persistence|5. Mobile Security & Biometrics|6. Multi-platform Frameworks (Flutter)|7. App Store Deployment Cycles|8. Mobile Performance Profiling,"iOS Developer, Android Developer, Product Designer",6-12 Months,"Xcode, Android Studio, Flutter, React Native"
DevOps Engineer,Infrastructure,"Docker, Kubernetes, AWS, CI/CD, Terraform, Linux, Shell Scripting",Explosive Growth (+35%),High,Bridge the gap between developers and IT operations by automating delivery and ensuring cloud infrastructure scalability.,1. Linux System Administration|2. Shell Scripting & Automation|3. Version Control (Git) Strategy|4. Continuous Integration (CI) Pipelines|5. Containerization with Docker|6. Orchestration with Kubernetes|7. Infrastructure as Code (Terraform)|8. Observability & Monitoring,"SRE Engineer, Cloud Architect, Platform Engineer",12-18 Months,"Kubernetes, Terraform, Jenkins, Ansible, Grafana"
Site Reliability Engineer,Infrastructure,"Go, Python, Observability, Kubernetes, Incident Response",Critical Demand (+30%),High,Apply software engineering practices to infrastructure and operations problems to build highly scalable and reliable systems.,1. Advanced Programming (Go/Python)|2. Distributed Systems Theory|3. Observability (SLIs/SLOs/Error Budgets)|4. Post-Mortem & Incident Response|5. Capacity Planning & Load Testing|6. Chaos Engineering Basics|7. Infrastructure Automation|8. Security Reliability Engineering,"DevOps Engineer, Cloud Engineer, Systems Architect",24-36 Months,"Prometheus, Grafana, Datadog, PagerDuty"
Database Administrator,Software,"SQL, Postgres, Oracle, Backups, Query Tuning, Clustering",Stable (Shift to Cloud DBs),Medium,"Manage and optimize database systems to ensure data integrity, performance, and security across an organization.",1. SQL Server/Postgres Internals|2. Query Performance Tuning|3. High Availability & Clustering|4. Backup & Disaster Recovery|5. Database Security Auditing|6. NoSQL Scaling Strategies|7. Data Migration Techniques|8. Cloud Database Management,"Data Architect, Backend Developer, BI Developer",12-24 Months,"Oracle, SQL Server, PostgreSQL, DB2"
Cybersecurity Analyst,Networks,"Network Security, Wireshark, SIEM tools, Penetration Testing, Linux, Cryptography",High Scarcity (+32%),Medium,Protect digital assets by monitoring networks for threats and performing vulnerability assessments and response.,1. Networking Protocols (TCP/IP)|2. Linux & Windows Security|3. Vulnerability Assessment Tools|4. Threat Intelligence Gathering|5. SIEM Log Analysis|6. Digital Forensics Basics|7. Identity & Access Management|8. Incident Response Frameworks,"Penetration Tester, Security Architect, Forensics Analyst",12-24 Months,"Wireshark, Metasploit, Splunk, Kali Linux"
Penetration Tester,Networks,"Ethical Hacking, Metasploit, Nmap, Web Security, Linux",High Growth (+28%),High,Assess the security of computer systems by simulating cyberattacks to find and document vulnerabilities.,1. Advanced Networking & Protocols|2. Web Application Exploitation|3. Network Pentesting|4. Scripting for Exploit Dev|5. Wireless & Social Engineering|6. Privilege Escalation Techniques|7. Post-Exploitation & Lateral Move|8. Technical Vulnerability Reporting,"Security Analyst, Ethical Hacker, Bug Bounty Hunter",18-30 Months,"Burp Suite, Metasploit, Nmap, Kali Linux"
Network Engineer,Networks,"Cisco, Routing, Switching, TCP/IP, Firewall, VPN, Wireshark",Steady (SDN Focus),Medium,"Design, implement, and manage local and wide area networks to ensure maximum uptime for users and systems.",1. OSI & TCP/IP Stack|2. IPv4/IPv6 Subnetting|3. Routing Protocols (OSPF/BGP)|4. Switching & VLAN Configuration|5. Firewall & VPN Implementation|6. Wireless Network Design|7. Software-Defined Networking (SDN)|8. Network Automation with Python,"Network Architect, Systems Admin, Security Engineer",6-12 Months,"Cisco IOS, Wireshark, SolarWinds, NetSim"
Data Scientist,Data Science,"Python, R, SQL, Statistics, Tableau, Pandas, Scikit-learn",Mature Market (+15%),High,Extract actionable insights from structured and unstructured data using statistical methods and predictive modeling.,1. Advanced SQL for Data Extraction|2. Exploratory Data Analysis (EDA)|3. Statistical Hypothesis Testing|4. Regression & Classification Models|5. Dimensionality Reduction|6. Data Visualization (Tableau/D3.js)|7. Big Data Fundamentals|8. Business Communication & Storytelling,"Data Analyst, ML Engineer, Quantitative Analyst",12-18 Months,"Pandas, R, Tableau, PowerBI, Scikit-learn"
Machine Learning Engineer,Data Science,"Python, PyTorch, TensorFlow, Linear Algebra, Scikit-learn, Statistics",Hyper Growth (+40%),High,Develop and deploy predictive models using vast datasets to power modern AI systems and recommendation engines.,1. Linear Algebra & Calculus|2. Probability & Statistics|3. Python for Data Science|4. Supervised & Unsupervised Learning|5. Deep Learning Frameworks (PyTorch)|6. Natural Language Processing (NLP)|7. Neural Network Optimization|8. MLOps & Model Deployment,"Data Scientist, AI Researcher, Data Engineer",18-24 Months,"PyTorch, TensorFlow, Jupyter, Scikit-learn"
Data Engineer,Data Science,"SQL, Spark, Hadoop, Python, ETL, Snowflake, Airflow",High Growth (+25%),High,Build the data pipelines and infrastructure that allow data scientists to access and analyze information.,1. Advanced SQL & Window Functions|2. Python for Data Engineering|3. Distributed Computing (Spark)|4. Data Warehousing (Snowflake)|5. ETL/ELT Pipeline Orchestration|6. NoSQL & Graph Databases|7. Data Modeling (Kimball/Vault)|8. Real-time Stream Processing,"Big Data Architect, Data Analyst, Database Developer",18-24 Months,"Apache Airflow, Spark, Snowflake, dbt"
Hardware Engineer,Hardware,"Circuit Design, PCB Layout, Signal Integrity, Components",Steady (+12%),Medium,"Design and develop physical electronic components, including circuit boards, processors, and peripheral devices.",1. Analog & Digital Circuit Design|2. Schematic Capture Fundamentals|3. Multi-layer PCB Layout|4. Signal & Power Integrity|5. Component Selection & Sourcing|6. Prototyping & Soldering|7. Electromagnetic Compatibility (EMC)|8. Design for Manufacturing (DFM),"VLSI Designer, PCB Engineer, Systems Engineer",18-24 Months,"Altium Designer, Allegro, LTspice"
Firmware Engineer,Hardware,"Embedded C, Assembly, ARM, Bootloaders, Debugging, RTOS",High Growth (+20%),High,"Develop low-level software that provides the control, monitoring, and data manipulation of various electronic devices.",1. Embedded C & Register-level Dev|2. Assembly for ARM/x86|3. RTOS Threading & Scheduling|4. Device Driver Development|5. Bootloader & OTA Design|6. Low-power Optimization|7. JTAG/SWD Debugging|8. Hardware/Software Co-design,"Embedded Systems Engineer, Hardware Engineer, Kernel Dev",12-18 Months,"Eclipse, IAR Embedded Workbench, Logic Pro"
Robotics Engineer,Hardware,"ROS, Control Theory, C++, Computer Vision, Mechanics",High Growth (+22%),High,"Design and build robotic systems, combining mechanical engineering, electronics, and computer science.",1. Statics & Dynamics|2. Control Systems Theory|3. Embedded C/C++ Programming|4. Robot Operating System (ROS)|5. Computer Vision & Perception|6. Path Planning Algorithms|7. Sensor Fusion (Kalman Filters)|8. Mechanical CAD Design,"Mechatronics Engineer, Embedded Dev, AI Specialist",24-36 Months,"ROS, Gazebo, SolidWorks, Python"
FPGA Design Engineer,Hardware,"VHDL, Verilog, Vivado, Quartus, Digital Logic Design, Signal Processing",Rapid Expansion (Data Centers) (+24%),High,Design high-speed hardware logic for real-time processing tasks like signal processing and telecommunications.,1. Boolean Algebra & Logic Gates|2. VHDL/Verilog Syntax|3. RTL Simulation & Testbench Design|4. FPGA Architecture & CLBs|5. Timing Closure & Constraints|6. Digital Signal Processing (DSP)|7. IP Core Integration|8. High-Level Synthesis (HLS),"Hardware Engineer, DSP Engineer, RTL Designer",18-30 Months,"Xilinx Vivado, Intel Quartus, ModelSim, MATLAB"
ASIC Design Engineer,Hardware,"Logic Design, Synthesis, Timing Closure, RTL, CDC",High Demand (+18%),Very High,Design the logic and structure of Application-Specific Integrated Circuits from specification to physical layout.,1. Digital Systems Design|2. RTL Coding (Verilog/VHDL)|3. Logic Synthesis & Netlist|4. Static Timing Analysis|5. Clock Domain Crossing (CDC)|6. Power Analysis & Optimization|7. Physical Design Flow|8. Post-Silicon Validation,"VLSI Engineer, SoC Architect, FPGA Designer",24-48 Months,"Cadence Genus, Synopsys Design Compiler, PrimeTime"
Signal Integrity Engineer,Hardware,"Electromagnetics, S-Parameters, HFSS, Transmission Lines",Critical Growth (HPC focus),Very High,"Ensure that high-speed signals maintain their integrity across PCBs, connectors, and cables.",1. Electromagnetics & Wave Theory|2. Transmission Line Modeling|3. S-Parameter Analysis|4. Crosstalk & Jitter Analysis|5. Power Integrity Basics|6. High-Speed Lab Measurement|7. Simulation Tools (HFSS/ADS)|8. System-level Margin Analysis,"Hardware Engineer, PCB Designer, Systems Architect",24-42 Months,"ANSYS HFSS, Keysight ADS, Oscilloscopes, TDR"
RF Hardware Engineer,Hardware,"RF Design, Smith Charts, Network Analyzers, Antennas, Filters",Stable/Moderate Growth (+10%),Very High,Design and test radio frequency circuits for wireless communication systems like 5G and satellite links.,1. Electromagnetics & Wave Theory|2. RF Circuit Components|3. S-Parameters & Smith Charts|4. Impedance Matching Techniques|5. Filter & Amplifier Design|6. Antenna Theory & Placement|7. RF Simulation (HFSS/ADS)|8. Spectrum & Network Analysis,"Wireless Engineer, Antenna Engineer, Systems Engineer",24-36 Months,"ADS, HFSS, Vector Network Analyzer, Spectrum Analyzer"
Power Electronics Engineer,Hardware,"SMPS, Power Converters, IGBTs, MOSFETs, Magnetics",Explosive (EV Market) (+30%),High,"Design power conversion systems for electric vehicles, renewable energy, and consumer electronics.",1. Analog Circuit Fundamentals|2. Power Semiconductor Physics|3. DC-DC Converter Topologies|4. AC-DC Rectification & Inverters|5. Magnetic Component Design (Inductors)|6. Feedback Control Loops|7. Thermal Management for Power|8. High-Voltage Safety & Testing,"Electrical Engineer, EV Systems Engineer, Hardware Lead",18-24 Months,"LTspice, MATLAB/Simulink, Oscilloscopes, Electronic Loads"
EMC/EMI Compliance Engineer,Hardware,"Electromagnetic Compatibility, FCC Standards, Shielding",Steady (+8%),High,Ensure that electronic products meet regulatory standards for electromagnetic interference and susceptibility.,1. Maxwell's Equations & Waves|2. Interference Mechanisms (Coupling)|3. Shielding & Grounding Theory|4. Filter Design for Compliance|5. Regulatory Standards (FCC/CE)|6. Anechoic Chamber Testing|7. EMI Diagnostic Tools|8. Mitigation Strategies (Gaskets/Ferrites),"Compliance Manager, Hardware Design Engineer, Quality Engineer",18-30 Months,"Spectrum Analyzers, LISN, TEM Cell, GTEM"
Hardware Test Engineer,Hardware,"Python, LabVIEW, Test Automation, Oscilloscopes, Data Acquisition",Steady Growth (+12%),Medium,Develop automated test benches to validate hardware functionality and reliability before mass production.,1. Basic Circuit Troubleshooting|2. Lab Instrumentation Mastery|3. Measurement Error Analysis|4. Python for Lab Automation|5. LabVIEW Visual Programming|6. Test Plan Documentation|7. Statistical Quality Control|8. Root Cause Analysis Techniques,"QA Engineer, Validation Engineer, Manufacturing Engineer",6-12 Months,"LabVIEW, Python (PyVISA), Oscilloscopes, Multimeters"
Systems Administrator,Infrastructure,"Linux, Windows Server, PowerShell, Bash, Active Directory",Steady/Evolving (+5%),Medium,"Maintain, configure, and ensure the reliable operation of computer systems, especially multi-user computers, such as servers.",1. Linux/Windows Server Setup|2. Shell Scripting (Bash/PowerShell)|3. Active Directory & LDAP|4. Virtualization (VMware/KVM)|5. Backup & Recovery Planning|6. Enterprise Storage (NAS/SAN)|7. Monitoring & Logging|8. Security Hardening Policies,"IT Manager, Site Reliability Engineer, Network Admin",12-24 Months,"Bash, PowerShell, Ansible, Nagios"
Technical Content Moderator,Online Services,"Policy Awareness, Data Sensitivity, Reporting, OSINT",High Demand (AI Safety focus),Low,Review user-generated technical content or code to ensure it adheres to platform guidelines and safety standards.,1. Digital Policy & Law Basics|2. Understanding Code Vulnerabilities|3. Content Management System (CMS)|4. OSINT Search Techniques|5. Data Anonymization Principles|6. Automated Filtering System logic|7. Psychological Resilience Training|8. Legal/Law Enforcement Reporting,"Community Manager, Trust & Safety Lead, Legal Assistant",6-12 Months,"Internal CMS, Python, Regex"
E-commerce Technical Assistant,Online Support,"Shopify/Amazon, HTML/CSS, Inventory, APIs",High Growth (+20%),Low,"Manage the technical backend of online stores, including theme customization, app integration, and API sync.",1. E-commerce Platform Architecture|2. Theme Customization (Liquid/HTML)|3. App & Plugin Integration|4. Product Data Modeling (CSV/SQL)|5. SEO for E-commerce Basics|6. API Integration (Stripe/PayPal)|7. Warehouse & Sync Automation|8. Analytics Dashboard Setup,"Operations Manager, Web Admin, Product Manager",6-12 Months,"Shopify, Amazon Seller Central, Google Analytics"
Remote Desktop Support specialist,Online Support,"RDP, VNC, Troubleshooting, Networking, OS",Stable (+5%),Low,Provide technical help by remotely accessing user machines to fix software and configuration errors.,1. Remote Protocol Theory (RDP/SSH)|2. Remote Access Software Security|3. OS Diagnostic Command Line|4. Patch Management & Deployment|5. Peripheral Driver Troubleshooting|6. Network Connectivity Debugging|7. Customer Communication Flow|8. Ticket Documentation Standards,"Technical Support L2, Systems Admin",3-9 Months,"AnyDesk, LogMeIn, Command Prompt/Terminal"
Social Media Analytics Tech,Online Services,"API, SQL, Python, Tableau, Social Platforms",Growing (+15%),Medium,Build the technical data pipelines that track social media performance and user engagement metrics.,1. Social Media Platform APIs|2. Data Scraping & Ingestion basics|3. SQL for Performance Metrics|4. Data Cleaning for Social Data|5. Visualization Design (Tableau)|6. Tracking Pixel Implementation|7. URL Parameter & UTM Strategy|8. Campaign Attribution Modeling,"Data Analyst, Marketing Tech Lead, BI Developer",12-18 Months,"GTM, SQL, Python, Tableau"
CRM Administrator,Software,"Salesforce, Hubspot, SQL, Process, Logic",Steady Growth (+12%),Medium,Manage the technical setup and data integrity of Customer Relationship Management (CRM) platforms.,1. CRM Data Schema Design|2. User Permission & Security Models|3. Workflow & Logic Automation|4. Data Import/Export (CSV/API)|5. SQL for Business Reporting|6. Integration with Email Systems|7. Dashboard & Analytics Design|8. Process Documentation (SOPs),"Operations Manager, Systems Analyst, Salesforce Lead",12-18 Months,"Salesforce, HubSpot, SQL"
Cybersecurity Operations (SOC) Analyst,Networks,"SIEM, Log Analysis, Incident Response, Linux",High Growth (+25%),Medium,Monitor security dashboards 24/7 to identify and respond to real-time cyber threats and breaches.,1. Networking Security (TCP/IP)|2. SIEM Platform Mastery (Splunk)|3. Log Analysis (Syslog/Auth)|4. Indicator of Compromise (IoC) Search|5. Alert Triaging & Prioritization|6. Incident Response Playbooks|11. Phishing & Malware Basics|8. Reporting for Security Leads,"Security Engineer, Threat Hunter, Forensic Analyst",12-18 Months,"Splunk, QRadar, AlienVault"
