job_title,specialization,required_skills,future_career_projection,difficulty,detailed_overview,learning_roadmap,related_careers,time_to_master,tools_used
ASIC Physical Design Engineer,Hardware,"Floorplanning, Placement, Routing, STA, DRC/LVS, TCL",Critical Scarcity (+20%),Very High,"Focus on the 'back-end' of chip design, turning logic gates into physical polygons on silicon.",1. VLSI Fundamentals|2. Logic Synthesis|3. Advanced Floorplanning|4. Clock Tree Synthesis (CTS)|5. Routing & Optimization|6. Static Timing Analysis (STA)|7. Physical Verification (DRC/LVS)|8. Tape-out Procedures,"VLSI Engineer, Layout Engineer, Hardware Architect",24-36 Months,"Innovus, IC Compiler II, Calibre, PrimeTime"
DFT (Design for Test) Engineer,Hardware,"Boundary Scan, ATPG, JTAG, RTL, Verification",High Growth (+18%),High,Implement the hardware structures (like scan chains) that allow chips to be tested for defects after manufacturing.,1. VLSI Logic Design|2. Fault Models (Stuck-at/At-speed)|3. Scan Chain Insertion|4. ATPG (Auto Test Pattern Gen)|5. JTAG/Boundary Scan Standards|6. Memory Built-in Self Test (BIST)|7. Compression Architecture|8. Silicon Bring-up & Diagnostics,"ASIC Engineer, Test Engineer, Hardware Architect",24-36 Months,"Tessent, Modus, PrimeTime"
Analog Layout Designer,Hardware,"LVS, DRC, Matching, Guard Rings, FinFET, Cadence",High Demand (+12%),High,"Manually draw the physical masks for analog circuits, ensuring precision matching and parasitic minimization.",1. Semiconductor Device Physics|2. Analog Circuit Topology Basics|3. Design Rule Check (DRC) Fundamentals|4. Layout vs Schematic (LVS) Mastery|5. Transistor Matching Techniques|6. Parasitic Capacitance Awareness|7. Guard Ring & Isolation Strategy|8. FinFET vs Planar Layout Rules,"Analog Designer, IC Mask Designer, VLSI Engineer",12-24 Months,"Cadence Virtuoso, Calibre, Assura"
Power Integrity Engineer,Hardware,"Electromagnetics, PDN, Simulation, PCB",High Demand (+15%),Very High,Focus on the electrical design of power distribution networks (PDN) to ensure stable voltage for high-speed chips.,1. Circuit Theory & AC Analysis|2. PDN Modeling & Simulation|3. Decoupling Capacitor Selection|4. Power Plane Resonance Analysis|5. DC Drop & IR Analysis|6. High-speed Load Modeling|7. PI/SI Co-simulation|8. Lab Measurement for PI,"Signal Integrity Engineer, Hardware Engineer, PCB Designer",24-42 Months,"Sigrity, HyperLynx PI, ANSYS"
Hardware Emulation Engineer,Hardware,"FPGA, Palladium, Zebu, Verification, RTL",Stable High-Value (+10%),Very High,Use specialized supercomputers to simulate chips at nearly real-time speeds before they are manufactured.,1. VLSI Logic Design|2. RTL Coding & Debugging|3. Emulation Platform Architecture|4. Compile & Build for Emulation|5. Transactor Development|6. Hybrid Emulation Workflows|7. Performance Profiling on Emu|8. Post-Silicon Validation Linkage,"Hardware Verification, ASIC Designer, FPGA Engineer",36-48 Months,"Palladium, Zebu, Protium, SystemVerilog"
Component Engineer,Hardware,"Sourcing, Life-cycle, Compliance, BOM",Steady (+8%),Low,Specialize in choosing and qualifying the electronic components used across a company's product line.,1. Electronic Component Physics|2. Manufacturer Data Sheet Analysis|3. Component Lifecycle & Obsolescence|4. Alternative Sourcing Strategy|5. Environmental Compliance (RoHS)|6. Failure Analysis for Components|7. Technical BOM Optimization|8. Supplier Technical Auditing,"Procurement Specialist, Hardware Engineer, Quality",12-24 Months,"SiliconExpert, Arena PLM, Excel"
ASIC Physical Verification Engineer,Hardware,"DRC, LVS, Calibre, Tape-out, Extraction",Niche Scarcity (+15%),Very High,Perform the final checks on a chip design to ensure it meets the physical requirements for manufacturing.,1. CMOS Fabrication Basics|2. Layout Design Principles|3. Design Rule Checking (DRC)|4. Layout vs Schematic (LVS)|5. Parasitic Extraction (RC)|6. Reliability Checks (EM/IR)|7. Tape-out Data Formats (GDSII)|8. Manufacturing Yield Analysis,"Physical Design Engineer, VLSI Engineer, Layout Designer",24-36 Months,"Calibre, IC Validator, Hercules"
Package Design Engineer,Hardware,"Thermal, Mechanical, Signal Integrity, Cadence APD",Emerging (Chiplet Focus) (+22%),High,Design the physical enclosure and interconnects that protect silicon dies and connect them to the PCB.,1. Materials Science (Polymers/Metal)|2. Semiconductor Packaging Types|3. Wirebonding vs Flip-chip|4. Thermal Expansion & Stress|5. Package Signal Integrity|6. Substrate Layout Design|7. Assembly Process Flow|8. Reliability & Warpage Testing,"Hardware Engineer, Mechanical Engineer, Materials Scientist",18-30 Months,"Cadence APD, ANSYS, SolidWorks"
Optical Engineer (Fiber/Lasers),Hardware,"Optics, Fiber, Photonics, Zemax, Lab Gear",High Growth (+18%),High,"Design and test systems that use light to transmit data, such as fiber optic transceivers and silicon photonics.",1. Physics of Light & Optics|2. Fiber Optic Waveguides|3. Laser & LED Physics|4. Optical Simulation (Zemax)|5. Photonic Integrated Circuits|6. High-speed Optical Testing|7. Signal Modulation (Optical)|8. Reliability for Photonics,"Hardware Engineer, RF Engineer, Networking",36-60 Months,"Zemax, Lumerical, Optical Spectrum Analyzer"
Signal Integrity Test Tech,Hardware,"Oscilloscopes, Lab gear, Probing, Eye Diagrams",High Growth (+18%),Medium,Assist Signal Integrity engineers by setting up lab tests and capturing high-speed waveforms.,1. High-speed Lab Safety|2. Oscilloscope Setup & Trigger|3. Passive & Active Probing|4. Eye Diagram Capture|5. TDR Measurement Basics|6. Lab Data Logging|7. Basic Signal Distortion ID|8. Test Report Generation,"SI Engineer, HW Test Tech",6-12 Months,"Keysight Scope, TDR, Lab Gear"
Hardware Design Reviewer,Hardware,"Architecture, Schematic, Layout, Review, Standards",Senior High-Value (+10%),Very High,A senior specialist who performs deep-dive technical reviews of other engineers' schematics and PCB layouts.,1. Advanced Component Theory|2. Schematic Review Checklists|3. Layout Review (SI/PI/DFM)|4. Design Standard Enforcement|5. Mentorship & Technical Feedback|6. System-level Risk Identification|7. Manufacturing Lesson Learned|8. Technical Design Governance,"Hardware Architect, Principal Engineer, EE Lead",48-72 Months,"Altium, Allegro, Valor"
Satellite Payload Engineer,Hardware,"RF, Digital Logic, Space-grade, Integration",Rapid Growth (+15%),Very High,Design the scientific instruments or communication systems that are carried by a satellite into orbit.,1. Space System Requirements|2. Radiation-hardened Electronics|3. RF Payload Architecture|4. Digital Signal Processing for Space|5. Power & Thermal Constraints|6. Space-grade Assembly Standards|7. Thermal Vacuum Testing|8. Launch Stress Analysis,"Satellite Engineer, RF Engineer, Systems Architect",36-60 Months,"STK, MATLAB, Altium, Vacuum Chambers"
Avionics Hardware Designer,Hardware,"DO-254, Circuit Design, Reliability, Aerospace",Steady (+8%),High,"Design the physical circuit boards and systems for aircraft, focusing on extreme environmental durability.",1. Aerospace Hardware Standards|2. Circuit Design for High Reliability|3. Power Supply for Avionics|4. Thermal & Vibration Analysis|5. Redundant Architecture Design|6. EMI/EMC for Aerospace|7. Functional Safety Validation|8. Certification Path Mastery,"Hardware Engineer, PCB Designer, Systems Eng",36-60 Months,"Altium, LTspice, DO-254 Workflows"
Rust Systems Programmer,Software,"Rust, Memory Safety, Concurrency, Low-level",Hyper Growth (+45%),High,Develop high-performance systems with a focus on memory safety and extreme concurrency using Rust.,1. Rust Ownership & Borrowing|2. Pattern Matching & Enums|3. Error Handling (Result/Option)|4. Zero-cost Abstractions|5. Smart Pointers (Box/Rc/Arc)|6. Async Programming with Tokio|7. FFI & Unsafe Rust Basics|8. Systems Integration & Profiling,"Software Engineer, Backend Dev, Kernel Dev",12-24 Months,"Cargo, Rust-analyzer, GDB"
Zapier Automation Architect,Online Support,"Zapier, Make, APIs, Logic, Webhooks",Rapid Expansion (+30%),Medium,Design complex multi-step automations that connect dozens of apps to streamline business operations.,1. Trigger & Action Logic|2. Webhook & API Fundamentals|3. JSON Data Mapping|4. Conditional Logic & Paths|5. Python/JS Snippets in Zaps|6. Error Handling & Auto-replay|7. Multi-app Workflow Design|8. Scale & Maintenance Strategy,"Operations Manager, Technical VA, Automations Lead",6-12 Months,"Zapier, Make (Integromat), Postman"
Notion Workspace Architect,Online Support,"Notion, Database design, Formula 2.0, API",High Growth (+20%),Low,"Design complex, interconnected databases and dashboards in Notion to serve as a company's 'Second Brain'.",1. Page & Block Hierarchy|2. Relational Database Design|3. Formula 2.0 Logic|4. Notion Template Architecture|5. API & Integration Setup|6. Permission & Sharing Security|7. UX Design for Workspaces|8. Scaling Large Team Spaces,"Project Manager, Operations Lead, Technical VA",3-9 Months,"Notion, Super.so, Zapier"
Discord Bot Developer,Software,"JavaScript/Python, Discord API, Webhooks, Hosting",Steady Growth (+15%),Medium,"Build and host custom bots for community management, moderation, and automated game interactions on Discord.",1. Discord.js or Discord.py Basics|2. Command Interaction API|3. Message Embedding & Components|4. Database Persistence (MongoDB)|5. OAuth2 for Discord|6. Scalable Bot Sharding|7. Permission & Safety Logic|8. Deploying to Cloud (Docker),"Backend Developer, Community Manager",6-12 Months,"Node.js, Docker, MongoDB"
Chrome Extension Developer,Software,"JavaScript, Browser APIs, Manifest V3, HTML/CSS",Stable (+10%),Medium,Create productivity and security tools that run directly inside the Google Chrome browser.,1. Manifest V3 Architecture|2. Background Service Workers|3. Content Script Injection|4. Browser Action & UI Design|5. Cross-domain API Requests|6. Storage & State Management|7. Publishing to Web Store|8. Privacy & Security Compliance,"Frontend Developer, Web Developer",6-12 Months,"Chrome DevTools, VS Code, Git"
PCB Assembly Technician,Hardware,"Soldering, SMT, Troubleshooting, Components",Stable (+5%),Low,"Perform the physical assembly and quality check of printed circuit boards, focusing on precision soldering.",1. Electronic Component ID|2. Through-hole & SMT Soldering|3. Read PCB Layouts & Silk|4. Multimeter Troubleshooting|5. Rework & Desoldering Skills|6. IPC Quality Standards|7. ESD Safety Protocols|8. Final Assembly Inspection,"Hardware Tech, QA Tech, Production Lead",3-6 Months,"Soldering Iron, Multimeter, Microscope"
Component Lifecycle Manager,Hardware,"PLM, Sourcing, Obsolescence, BOM",Steady (+10%),Medium,Manage the long-term health of hardware products by tracking component availability and finding alternates.,1. Electronics Market Trends|2. Component Obsolescence (PCN)|3. Alternative Part Identification|4. PLM Database Management|5. Sourcing Risk Analysis|6. Environmental Compliance (RoHS)|7. Strategic Inventory Planning|8. Supplier Relationship Mgmt,"Procurement Lead, Component Eng, HW Lead",12-24 Months,"Arena PLM, SiliconExpert, Excel"
Technical Virtual Assistant (Funnel focus),Online Support,"Landing Pages, GTM, Email Logic, CRM, Tracking",Steady Growth (+15%),Low,"Design and implement the technical backend of marketing funnels, ensuring data flows correctly between apps.",1. Funnel Architecture Mapping|2. Landing Page Builder Tech|3. Form & Webhook Integration|4. Email Sequence Logic|5. Tracking Pixel Installation|6. Conversion Event Setup (GTM)|7. CRM Lead Routing Logic|8. Funnel Performance Reporting,"Marketing Ops, Web Admin, VA",6-12 Months,"Webflow, GTM, ConvertKit, Zapier"
Technical Customer Success Rep (SaaS),Online Support,"Relationship, Troubleshooting, Software Literacy, CRM",Stable (+8%),Low,Support SaaS clients by helping them resolve technical friction and ensuring they use advanced features.,1. Product Functional Mastery|2. Technical Discovery Questioning|3. Browser-based Troubleshooting|4. Account Health Monitoring|5. Feedback Loop Documentation|6. Feature Adoption Training|7. Support Ticket Escalation Flow|8. Quarterly Success Planning,"CSM, Support L2, Account Exec",6-12 Months,"Salesforce, Intercom, Zoom"
WordPress Security Specialist,Online Services,"Linux, SQL, Malware Removal, Firewalls, PHP",High Growth (+18%),Medium,Focus exclusively on hardening WordPress sites against attacks and cleaning up infected environments.,1. WordPress Core File Structure|2. Common PHP Attack Vectors|3. Database Sanitization Basics|4. Server-level Firewalls (WAF)|5. Malware Signature Identification|6. SSL/TLS Certificate Mgmt|7. Automated Backup & Recovery|8. Hardening .htaccess & WP-Config,"Web Admin, Cybersecurity Analyst, WP Dev",12-24 Months,"Wordfence, Sucuri, Linux CLI"
Shopify Technical Specialist,Online Services,"Liquid, APIs, CSS, JavaScript, Webhooks",Rapid Growth (+22%),Medium,"Manage the advanced technical side of Shopify stores, including custom Liquid coding and third-party API sync.",1. Liquid Template Syntax|2. Shopify Storefront API|3. Theme Theme Customization|4. App Integration & Conflict Triage|5. Product CSV Data Management|6. Checkout Logic & Extensions|7. Webhook Event Monitoring|8. Store Speed Optimization,"Web Dev, E-commerce Manager, VA",6-18 Months,"Shopify, VS Code, Postman"
Discord Community Architect (Technical),Online Services,"Bot Logic, Webhooks, API, Permission Modeling",Growing (+12%),Low,"Build complex Discord server structures with automated roles, verification gates, and external service integrations.",1. Discord Permissions Hierarchy|2. Bot Strategy & Selection|3. Webhook Data Ingestion|4. Verification Logic (OAuth)|5. Automated Moderation Setup|6. Community Engagement Tooling|7. Discord API Basics|8. Server Scalability Planning,"Community Manager, Discord Bot Dev, VA",6-12 Months,"Discord, Zapier, Carl-bot"
Technical Virtual Assistant (Automation focus),Online Support,"Zapier, Make, Logic, APIs, Spreadsheet automation",High Growth (+25%),Medium,A VA dedicated to eliminating manual tasks for businesses using no-code automation platforms.,1. Workflow Process Mapping|2. Trigger-Action Logic|3. Multi-step Zap Construction|4. JSON Data Parsing Basics|5. Error Handling & Auto-retry|6. Spreadsheet Automation (AppsScript)|7. API Connection Management|8. Automation ROI Reporting,"Automations Lead, Operations Manager, VA",6-12 Months,"Zapier, Make, Google Sheets"
Remote IT Help Desk (Level 1),Online Support,"Hardware, Windows/Mac, Networking, Ticketing",Stable (+5%),Low,The first point of contact for remote employees facing hardware or software issues in a corporate environment.,1. Remote OS Diagnostics|2. Common App Troubleshooting|3. Corporate VPN Setup|4. Identity Verification Flow|5. Ticketing Priority Management|6. Knowledge Base Utilization|7. Peripheral Hardware Setup|8. Customer Service Etiquette,"Help Desk L2, Systems Admin",3-6 Months,"ServiceNow, AnyDesk, Slack"
Technical Virtual Assistant (Lead Gen Tech),Online Support,"LinkedIn, CRM, Web Scraping, Email Tech",Steady (+10%),Low,Manage the technical tools for finding and reaching out to potential B2B leads.,1. Advanced Boolean Searching|2. Technical Persona Mapping|3. Email Deliverability Tech|4. LinkedIn Automation Tools|5. Web Scraping Basics|6. CRM Lead Routing|7. A/B Testing Outreach Copy|8. Sourcing Data Analytics,"Sourcing Specialist, Sales Ops, VA",6-12 Months,"LinkedIn Sales Nav, Apollo.io, HubSpot"
Data Analyst (Marketing focus),Online Support,"GTM, GA4, SQL, Visualization, Pixels",Steady Growth (+12%),Medium,Track and analyze digital marketing performance using technical tracking and data visualization tools.,1. Google Tag Manager (GTM)|2. GA4 Event Architecture|3. SQL for Data Extraction|4. URL Parameter Strategy|5. Dashboarding (Looker Studio)|6. Attribution Modeling basics|7. Data Hygiene & Cleaning|8. Insights Interpretation,"Marketing Analyst, Data Scientist, VA",12-18 Months,"GTM, GA4, SQL, Looker Studio"
Technical Support Representative (Call Center),Online Support,"VoIP, Ticketing, Troubleshooting, Communication",Stable (+5%),Low,"Phone-based technical support for consumer products, requiring fast triage and clear verbal instructions.",1. Phone Etiquette & Branding|2. Call Triage Software Mastery|3. Technical Discovery Questions|4. Remote Fix Instructions|5. Quick Ticketing Documentation|6. Escalation Threshold Logic|7. VoIP System Basics|8. De-escalation Techniques,"Support Lead, Training Coordinator",3-6 Months,"Five9, Zendesk, Avaya"
Remote Server Support Tech,Online Support,"Linux, SSH, Scripting, Monitoring, Logs",Steady (+10%),Medium,"Monitor and troubleshoot remote server health, performing updates and investigating log errors.",1. Linux Terminal Navigation|2. Remote Access (SSH) Security|3. Server Health Dashboards|4. Log File Triage basics|5. Patching & Update Lifecycle|6. Basic Shell Scripting|7. Alert Response Protocols|8. System Documentation,"Systems Admin, DevOps, Support L2",12-18 Months,"Linux, Nagios, Datadog"
Implementation Specialist (Cloud Software),Online Support,"Configuration, Training, SQL, APIs, Project Flow",Steady (+12%),Medium,Guide new customers through the technical setup and migration to cloud-based software platforms.,1. Cloud Software Architecture|2. Client Requirement Scoping|3. Data Migration Flow (CSV/API)|4. Custom Configuration Logic|5. User Permission Setup|6. Technical Training Delivery|7. Post-launch Validation|8. Support Handoff Documentation,"CS Manager, Project Manager, Solutions Eng",12-24 Months,"Jira, SQL, Zoom, Excel"
Technical Sourcing Associate,Online Services,"LinkedIn, Boolean, Talent Tech, Research",Growing (+15%),Low,Identify and engage difficult-to-find technical talent for software and hardware engineering roles.,1. Technical Job Family Mapping|2. Advanced Boolean Search|3. X-Ray Sourcing Techniques|4. Technical Skill Verification|5. Outreach Personalization|6. Candidate Pipeline Management|7. Talent Market Intelligence|8. Recruiting Tool Admin,"Tech Recruiter, Talent Analyst, HR Lead",6-12 Months,"LinkedIn Recruiter, Gem, Hiretual"
Multimedia Workflow Specialist,Online Services,"Workflows, Media Tech, Documentation, Process",Growing (+10%),Low,"Document and optimize the technical process for media creation, from raw footage to final delivery.",1. Media Lifecycle Mapping|2. Technical Specification Writing|3. Metadata Standard Design|4. Storage Tiering Strategy|5. Workflow Automation basics|6. User Training for MAM|7. Efficiency Metric Tracking|8. Content Security Protocols,"MAM Manager, Video Editor, Project Mgr",12-18 Months,"Visio, Slack, Notion"
SaaS Technical Implementation Support,Online Support,"SaaS, Setup, Support, Training, APIs",Steady (+8%),Low,Help SaaS customers with the technical configuration of their accounts and initial app integrations.,1. SaaS Onboarding Frameworks|2. App Integration Configuration|3. Data Mapping Foundations|4. Setup Error Troubleshooting|5. User Account Bulk Creation|6. Technical Knowledge Base usage|7. Customer Training Basics|8. Initial Success Reporting,"CS Associate, Implementation Lead",6-12 Months,"Excel, Zoom, Slack"
Technical Virtual Assistant (E-commerce Focus),Online Support,"Shopify, WooCommerce, Inventory, CSS",Steady (+10%),Low,"Provide technical support for online stores, managing inventory sync, theme tweaks, and app setup.",1. E-commerce Platform Navigation|2. Inventory Management Logic|3. Theme UI Tweaks (CSS/HTML)|4. App Installation & Config|5. Product Data Sanitization|6. Payment Gateway Testing|7. Order Workflow Automation|8. Sales Dashboard Maintenance,"Web Admin, E-commerce Manager, VA",6-12 Months,"Shopify, WooCommerce, Excel"
Remote Database Support Specialist,Online Support,"SQL, Troubleshooting, Connectivity, Maintenance",Stable (+8%),Medium,Monitor database health and resolve connectivity or query issues for remote clients.,1. Database Architecture Basics|2. Connectivity Debugging (ODBC)|3. SQL Error Log Investigation|4. Query Performance Monitoring|5. Security Permission Fixes|6. Backup Verification Support|7. Database Documentation|8. Handoff to DBA Teams,"Database Admin, Support L2, Data Analyst",12-24 Months,"SQL Server, MySQL, Oracle"
Technical Sourcing Coordinator (Remote focus),Online Services,"Scheduling, ATS, Remote Sourcing, Communication",Stable (+5%),Low,Manage the scheduling and logistics for a remote-first technical sourcing team.,1. Remote Recruiting Workflow|2. Global Interview Scheduling|3. Remote Candidate Experience|4. ATS & CRM Data Integrity|5. Team Coordination (Remote)|6. Basic Technical Research|7. Sourcing Performance Reporting|8. Virtual Communication Etiquette,"Sourcer, Tech Recruiter, HR Assistant",3-9 Months,"LinkedIn, Calendly, Zoom"
Technical Support Representative (B2B Software),Online Support,"B2B, Troubleshooting, SLAs, Ticketing",Stable Growth (+10%),Low,"Support complex business software, focusing on enterprise user management and SLA adherence.",1. B2B Support Standards|2. SLA & Priority Management|3. Enterprise Workflow Discovery|4. Ticket Documentation Flow|5. Remote Support Tooling|6. Software Configuration Basics|7. User Training Foundations|8. Cross-departmental Triage,"Support L2, Implementation, CS Manager",6-12 Months,"Zendesk, Jira, Salesforce"
Help Desk SME (Software Suite),Online Support,"Product Mastery, IT Support, Troubleshooting",Steady (+10%),Medium,Focus on being the 'Subject Matter Expert' for a specific software suite within a large company.,1. Software Suite Mastery|2. Advanced User Troubleshooting|3. IT Policy Implementation|4. Knowledge Base Management|5. Technical Training Delivery|6. SME Incident Management|7. Support Process Improvement|8. Stakeholder Technical Support,"Systems Admin, Support Manager, IT Analyst",12-24 Months,"ServiceNow, Notion, Zoom"
Technical Virtual Assistant (Social Tech Focus),Online Services,"GTM, Pixels, Meta Ads, Analytics, Scheduling",Stable (+10%),Low,"Manage the technical side of social media: tracking pixels, ad account setup, and performance reporting.",1. Tracking Pixel Architecture|2. GTM Event Tagging|3. Social Media Ad Account Setup|4. UTM Link Strategy|5. Basic API Data Extraction|6. Analytics Dashboard Building|7. Social Tech Stack Integration|8. Automated Reporting Tools,"Marketing Ops, Social Media Manager, Data Analyst",6-12 Months,"GTM, Facebook Events Manager, Google Analytics"
Remote IT Coordinator (Assets),Online Support,"Inventory, Onboarding, Remote Tech, Logistics",Steady (+10%),Low,"Manage the shipping, tracking, and remote setup of hardware for distributed workforces.",1. Remote Asset Logistics|2. MDM Enrollment (Jamf/Intune)|3. Remote Computer Imaging|4. Hardware Tracking Systems|5. Shipping & Customs Basics|6. Offboarding Wipe Procedures|7. Laptop Troubleshooting basics|8. Asset Finance Reporting,"IT Asset Manager, Systems Admin, Ops Manager",6-12 Months,"Jamf, ServiceNow, Fedex/UPS Dashboards"
Technical Documentation Assistant,Online Services,"Writing, Markdown, Git, Formatting, Docs",Steady (+8%),Low,"A VA who supports technical writers by formatting docs, updating screenshots, and managing version control.",1. Technical Communication Basics|2. Markdown & Formatting Standards|3. Image Editing for Tech Docs|4. Version Control (Git) basics|5. Documentation Tool Admin|6. Grammar & Style Consistency|7. Wiki/Knowledge Base Setup|8. Documentation Review Flow,"Technical Writer, Content Developer, Web Admin",6-12 Months,"Notion, GitHub, Snagit"
API Support Engineer,Online Support,"APIs, Postman, Webhooks, Troubleshooting",Rapid Growth (+22%),Medium,A specialized support role dedicated to helping developers integrate with a company's public APIs.,1. REST & Webhook Fundamentals|2. JSON/XML Data Structures|3. API Authentication (OAuth)|4. Postman for Debugging|5. Reading Server Error Logs|6. API Rate Limiting Logic|7. Integration Code Review|8. Developer Portal Support,"API Engineer, Developer Advocate, Support L3",12-18 Months,"Postman, Splunk, GitHub"
Remote Server Admin (L1),Online Support,"Linux, Servers, Patching, Monitoring",Stable/Moderate (+7%),Low,"Provide basic maintenance and monitoring for remote servers, responding to alerts and applying updates.",1. Server Hardware Basics|2. Linux Command Line Core|3. Automated Update Management|4. Server Health Monitoring|5. Remote Access (SSH) Security|6. Log File Basics|7. Initial Alert Response Flow|8. Server Documentation Standards,"Systems Admin, DevOps, Support L2",6-12 Months,"Linux, Datadog, Ansible"
Virtual Assistant (Tech Operations Focus),Online Services,"Process, Automation, Tooling, Coordination",Growing (+15%),Low,"Support tech team leads by managing documentation, tool configurations, and internal communication.",1. Tech Stack Auditing|2. Internal Process Modeling|3. Tool Configuration (Slack/Jira)|4. Operation Metric Reporting|5. Team Coordination Workflows|6. Documentation Management|7. Automation Setup (Zapier)|8. Tech Ops Roadmap Support,"Operations Lead, Project Manager, Systems Analyst",12-18 Months,"Slack, Notion, Zapier, Jira"
WordPress Maintenance Tech,Online Services,"WP, Security, Speed, Updates, PHP",Stable (+5%),Low,"Focus on the technical health of WordPress sites: backups, updates, and minor PHP/CSS troubleshooting.",1. WP Update Lifecycle|2. Backup & Restore Procedures|3. Site Speed Optimization|4. Security Scanning & Cleanup|5. Database Optimization Basics|6. Minor CSS/PHP Fixes|7. Plugin Conflict Triage|8. Maintenance Reporting,"Web Admin, WordPress Dev, SEO Tech",6-12 Months,"WordPress, ManageWP, Wordfence"
