job_title,specialization,required_skills,future_career_projection,difficulty,detailed_overview,learning_roadmap,related_careers,time_to_master,tools_used
Technical Community Moderator (Code focus),Online Services,"Git, Pull Requests, Code Review, Community",Evolving (+12%),Medium,"Moderate developer communities, reviewing code contributions and maintaining repository health.",1. Git Workflow Mastery (PR/Issue)|2. Code Style Guide Enforcement|3. Collaborative Debugging|4. Community Management Standards|5. Automated CI/CD Alert Review|6. Documentation Maintenance|7. Security Vulnerability Triage|8. Contributor Enablement,"Developer Advocate, Open Source Lead, QA",12-24 Months,"GitHub, GitLab, Discord"
Technical Data Entry (Database focus),Online Services,"SQL, Excel, Data Hygiene, ETL basics",Stable (+5%),Low,"Manage large datasets, ensuring technical accuracy, correct formatting, and database integrity.",1. Database Record Structure|2. SQL for Data Entry/Edit|3. Advanced Excel (PowerQuery)|4. Data Normalization Rules|5. Duplicate Detection Logic|6. Regular Expressions (Regex)|7. Data Privacy & PII Handling|8. Basic Automation (VBA/Python),"Data Analyst, Database Admin, Admin Assistant",3-9 Months,"SQL, Excel, Airtable"
Virtual Assistant (Project Management Focus),Online Services,"Jira, Asana, Notion, Automation, Sprints",Steady Growth (+12%),Low,"Support technical teams by managing timelines, updating task statuses, and organizing documentation.",1. Agile & Scrum Foundations|2. Project Tool Architecture|3. Task Dependency Logic|4. Sprint Planning Logistics|5. Knowledge Base (Notion) Setup|6. Automated Status Reporting|7. Team Resource Tracking|8. Meeting Facilitation Basics,"Project Manager, Scrum Master, Operations Lead",6-12 Months,"Jira, Notion, Asana, Slack"
Technical Webinar Assistant,Online Support,"Streaming, AV, Zoom, Troubleshooting, OBS",Steady (+8%),Low,"Provide the backend technical support for live webinars, managing audio, video, and audience interactions.",1. Streaming Hardware Setup|2. Webinar Platform Mastery (Zoom)|3. Audio/Video Troubleshooting|4. Live Engagement Tooling (Polls)|5. OBS for Stream Composition|6. Local Recording & Backup Flow|7. Post-webinar Data Export|8. Live Technical Crisis Mgmt,"Multimedia Tech, Event Coordinator",3-6 Months,"Zoom, OBS, Slido"
CRM Technical Specialist (Support),Online Support,"Salesforce, CRM, Troubleshooting, Integrations",High Growth (+18%),Medium,"Technical support role specifically for resolving CRM errors, integration failures, and data sync issues.",1. CRM Platform Architecture|2. Data Synchronization Debugging|3. Plugin/App Error Resolution|4. User Permission Auditing|5. Automated Workflow Testing|6. API Error Log Investigation|7. Technical SOP Development|8. Client Configuration Support,"CRM Admin, Business Analyst, Support L2",12-18 Months,"Salesforce, HubSpot, Zapier"
Remote Network Support tech,Online Support,"Networking, Routers, VPN, Troubleshooting",Stable (+7%),Medium,"Provide technical support for remote employees' network setups, including home VPNs and corporate routers.",1. Home Networking Architecture|2. VPN Protocol Troubleshooting|3. Router Config & Hardening|4. ISP Latency & Jitter Analysis|5. Wireless Interference Debug|6. Remote Network Monitoring|7. Security Tunnel Theory|8. Remote Access Documentation,"Network Engineer, IT Support L2",12-18 Months,"Cisco Meraki, Wireshark, OpenVPN"
Technical Lead Generation Assistant,Online Services,"LinkedIn, Sourcing, Technical Mapping, CRM",Steady (+10%),Low,A VA who focuses on technical sales: finding engineers at target companies and mapping technical departments.,1. Technical Org Chart Mapping|2. Advanced LinkedIn Searching|3. Technical Persona Identification|4. CRM Data Hygiene|5. Email Deliverability Tech|6. Lead Qualification Logic|7. Technical Scripting for Outreach|8. Conversion Data Reporting,"Sales Ops, Tech Recruiter, Sales Lead",6-12 Months,"LinkedIn Sales Navigator, Gem"
Application Support Analyst,Online Support,"SQL, Logs, App Dev, Troubleshooting",High Growth (+15%),Medium,Analyze and resolve application-level errors for internal or external software users.,1. Application Lifecycle Mgmt|2. SQL for Record Inspection|3. Application Log Triage|4. Environment Variable Debugging|5. API Response Analysis|6. Patch & Version Testing|7. Cross-team Triage Logic|8. User Documentation Authoring,"Software Engineer, Business Analyst, QA",12-24 Months,"Splunk, SQL, Postman, Jira"
Tech Support Lead (Remote Teams),Online Support,"Leadership, Remote Ops, KPIs, Training",Rapid Expansion (+20%),Medium,"Manage a fully remote team of tech support agents, focusing on remote productivity and technical standards.",1. Remote Team Leadership|2. Online Productivity Tooling|3. Remote Onboarding Design|4. Global SLA Management|5. Virtual Team Culture Building|6. Support Automation Strategy|7. Escalation Management (Remote)|8. Performance Data Analytics,"Support Manager, Operations Lead, IT Director",24-36 Months,"Slack, Zoom, Jira, Lattice"
Technical Virtual Assistant (Marketing Focus),Online Services,"Email Marketing, Funnels, Automation, Analytics",Steady Growth (+12%),Low,"Manage the technical execution of marketing campaigns, from email automation to funnel tracking.",1. Marketing Tech Stack Integr|2. Email Deliverability Tech|3. Landing Page Tech Setup|4. Funnel Logic & Sequencing|5. Tagging & Tracking Architecture|6. Marketing Data Extraction|7. A/B Test Implementation|8. Campaign ROI Dashboarding,"Marketing Ops, PMM, Growth Engineer",12-18 Months,"Mailchimp, ActiveCampaign, GTM"
SaaS Implementation Support,Online Support,"SaaS, Configuration, Training, Troubleshooting",Steady (+10%),Low,Help SaaS customers with the technical steps of setting up their accounts and initial data imports.,1. SaaS Setup Frameworks|2. Data Mapping & Formatting|3. Customer Technical Training|4. API Connection Basics|5. User Permission Setup|6. Troubleshooting Setup Errors|7. Product Education Foundations|8. Handoff to Long-term Support,"Implementation Specialist, CS Manager",6-12 Months,"Excel, Zoom, Slack"
Technical Moderator (Security focus),Online Services,"Security, Phishing, OSINT, Moderation",Critical Growth (+25%),Medium,"Moderate communities with a focus on identifying malicious links, malware, and social engineering attempts.",1. Social Engineering Awareness|2. Link & File Analysis Basics|3. Community Safety Policies|4. Malware Triage Foundations|5. User Behavioral Analytics|6. Incident Response Reporting|7. Bot Prevention Logic|8. Digital Forensics basics,"Security Analyst, Community Mgr, Trust & Safety",12-24 Months,"VirusTotal, Discord Bots, Python"
Remote IT Coordinator,Online Support,"Inventory, Onboarding, Remote Tech, Logistics",Steady (+10%),Low,"Manage the logistics of hardware for remote teams: shipping laptops, tracking returns, and remote wipes.",1. Remote Asset Logistics|2. MDM Enrollment (Jamf/Intune)|3. Remote Computer Imaging|4. Hardware Tracking Systems|5. Shipping & Customs Basics|6. Offboarding Wipe Procedures|7. Laptop Troubleshooting basics|8. Asset Finance Reporting,"IT Asset Manager, Systems Admin, Ops Manager",6-12 Months,"Jamf, ServiceNow, Fedex/UPS Dashboards"
Remote SQL Support Tech,Online Support,"SQL, Databases, Troubleshooting, Queries",Growing (+12%),Medium,"Remote support role focused on fixing database errors, broken queries, and data integrity issues for users.",1. SQL Core Mastery|2. Database Connectivity Debugging|3. Query Performance Analysis|4. Data Integrity Auditing|5. Database Security Basics|6. Export/Import Troubleshooting|7. Report Query Generation|8. Database Configuration Support,"Database Admin, Support L2, Data Analyst",12-18 Months,"SQL Server, MySQL, Postgres"
CRM Technical Consultant (Remote),Online Services,"CRM, Strategy, Implementation, Integrations",High Growth (+20%),High,Provide expert remote advice on how to build and integrate a company's CRM system for scale.,1. CRM Strategic Architecture|2. Business Process Optimization|3. High-level Integration Design|4. Data Governance Strategy|5. Enterprise User Management|6. Custom Development Scoping|7. Tech Stack ROI Analysis|8. Strategic CRM Roadmap Design,"CRM Architect, Solutions Architect, CTO",24-48 Months,"Salesforce, Mulesoft, Lucidchart"
Technical Customer Support (API focus),Online Support,"APIs, Postman, Webhooks, Troubleshooting",Rapid Growth (+22%),Medium,A support role dedicated to helping developers troubleshoot and integrate with a product's public APIs.,1. REST & Webhook Fundamentals|2. JSON/XML Data Structures|3. API Authentication (OAuth)|4. Postman for Debugging|5. Reading Server Error Logs|6. API Rate Limiting Logic|7. Integration Code Review|8. Developer Portal Support,"API Engineer, Developer Advocate, Support L3",12-18 Months,"Postman, Splunk, GitHub"
Virtual Assistant (Tech Ops Focus),Online Services,"Process, Automation, Tooling, Coordination",Growing (+15%),Low,"Focus on the operations of a tech team: managing the tool stack, documenting processes, and coordinating.",1. Tech Stack Auditing|2. Internal Process Modeling|3. Tool Configuration (Slack/Jira)|4. Operation Metric Reporting|5. Team Coordination Workflows|6. Documentation Management|7. Automation Setup (Zapier)|8. Tech Ops Roadmap Support,"Operations Lead, Project Manager, Systems Analyst",12-18 Months,"Slack, Notion, Zapier, Jira"
Remote IT Help Desk (Enterprise),Online Support,"AD, Office 365, VPN, Hardware troubleshooting",Steady Growth (+10%),Low,"Support a large corporate workforce remotely, managing identities, software access, and hardware issues.",1. Enterprise Identity (AD/O365)|2. Corporate VPN Troubleshooting|3. Software Deployment Tools|4. Identity Verification Flow|5. Enterprise Security Policies|6. Remote Peripheral Debugging|7. Ticketing Priority Logic|8. Knowledge Base Utilization,"Systems Admin, Support L2, IT Manager",6-12 Months,"Active Directory, Intune, ServiceNow"
Technical Sales Coordinator (Remote),Online Services,"CRM, Lead Gen, Tech Awareness, Scheduling",Steady (+10%),Low,"A VA who supports technical sales teams by managing leads, scheduling demos, and preparing tech materials.",1. Technical Sales Funnel|2. Lead Qualification Basics|3. CRM Management (Salesforce)|4. Sales Presentation Formatting|5. Demo Scheduling & Coordination|6. Technical Material Organization|7. Basic Sales Reporting|8. Customer Outreach Strategy,"Sales Ops, Account Exec, Technical Recruiter",6-12 Months,"Salesforce, Outreach, Calendly"
Remote Software Support (SME),Online Support,"Product Mastery, Training, Troubleshooting",Steady Growth (+12%),Medium,"The 'Subject Matter Expert' for a specific software, providing deep technical help and training for users.",1. Product Functional Mastery|2. Advanced User Scenarios|3. Technical Training Delivery|4. Knowledge Base Authoring|5. Product Feedback Collection|6. High-level Bug Triage|7. Feature Adoption Strategy|8. Stakeholder Technical Support,"Product Manager, CS Manager, Implementation",12-24 Months,"Zoom, Notion, Jira"
Technical Sourcing Specialist (Online Tech),HR,"Sourcing, Remote Market, Tech Skills, Recruiting",Growing (+15%),Low,"Focus on hiring for remote tech roles: Support, VAs, and QA, understanding the specific remote tech stack.",1. Remote Talent Market Intel|2. Online Role Sourcing Logic|3. Technical Literacy (Remote Tools)|4. Candidate Outreach Strategy|5. Virtual Interview Coordination|6. Talent Pipeline Management|7. Remote Work Competency Search|8. Sourcing Data Analytics,"Tech Recruiter, HR Lead, Talent Lead",6-12 Months,"LinkedIn, Gem, Excel"
Cloud Operations Support (L1),Infrastructure,"Cloud Monitoring, Alerts, Basic CLI, Patching",High Growth (+20%),Medium,"Monitor cloud health 24/7, responding to alerts and performing basic remediation steps on virtual infrastructure.",1. Cloud Service Foundations|2. Infrastructure Monitoring (CloudWatch)|3. Initial Alert Response Flow|4. Cloud Resource Restarting|5. Basic CLI Commands|6. Incident Documentation|7. Cloud Backup Verification|8. Escalation Triage Rules,"Cloud Engineer, DevOps, Systems Admin",12-18 Months,"AWS, Datadog, PagerDuty"
Data Quality Technical Assistant,Online Services,"Data Hygiene, SQL, Excel, Reporting",Steady (+8%),Low,"Specialized VA who ensures technical data is clean, correctly tagged, and ready for analysis in a database.",1. Data Integrity Principles|2. SQL for Data Validation|3. Advanced Excel Data Cleaning|4. Record Deduplication Logic|5. PII & Privacy Standards|6. Automated Data Checks|7. Accuracy Reporting Dashboards|8. Data Documentation (Glossary),"Data Analyst, Database Admin, Business Analyst",6-12 Months,"SQL, Excel, Airtable"
Virtual Assistant (DevOps Support),Online Services,"Docker, Git, CI/CD, Documentation, Automation",High Niche Demand (+22%),Medium,"Support DevOps teams by managing documentation, monitoring alerts, and performing basic automation tasks.",1. DevOps Culture & Lifecycle|2. Basic Docker Commands|3. Version Control (Git) Basics|4. Monitoring Dashboard Viewing|5. Incident Documentation Support|6. Tooling Configuration (Slack/PagerDuty)|7. Automated Status Updates|8. Technical Wiki Management,"DevOps Engineer, SRE, Systems Admin",12-18 Months,"Docker, GitHub, Slack, Notion"
Remote Technical Trainer,Online Services,"Teaching, Product Knowledge, Presentation, AV",Steady Growth (+12%),Low,Design and deliver live technical training sessions for software or hardware users over the internet.,1. Adult Learning Theory|2. Technical Content Design|3. Live Presentation Skills|4. Virtual Classroom Tools (Zoom)|5. Video/Audio Setup Mastery|6. Feedback & Assessment Design|7. Technical Demo Excellence|8. Ongoing Learning Path Design,"Product Manager, CS Lead, Technical Writer",12-24 Months,"Loom, Zoom, Camtasia, PowerPoint"
Technical Help Desk Lead (Remote),Online Support,"Leadership, Remote Ops, IT Standards",Steady (+10%),Medium,"Manage a remote help desk team, ensuring they meet IT standards and provide high-quality support.",1. Remote Help Desk Strategy|2. Team Leadership (Remote)|3. Remote IT Security Standards|4. Service Management Frameworks|5. Team Performance Analytics|6. Resource Planning (Shift Mgmt)|7. Strategic IT Roadmap Support|8. Stakeholder Influence Skills,"Support Manager, IT Manager, Systems Admin",24-48 Months,"ServiceNow, Slack, Jira, Lattice"
Technical Recruiter (QA/Testing focus),Online Services,"QA Literacy, Sourcing, Screening, Testing",Steady Growth (+12%),Low,"Specialize in hiring QA engineers and SDETs, requiring deep knowledge of testing tools and methodologies.",1. QA & Testing Role Mapping|2. Testing Tool Keyword Sourcing|3. Screening Automation Skills|4. QA Process Literacy|5. Market Compensation for QA|6. Talent Pipeline Management|7. Sourcing Analytics|8. Onboarding QA Teams,"Tech Recruiter, HR Lead, Talent Lead",6-12 Months,"LinkedIn, GitHub, Excel"
Technical Sourcing Coordinator (Remote),Online Services,"Scheduling, ATS, Remote Sourcing, Communication",Stable (+5%),Low,Manage the logistics and coordination for a remote technical sourcing team.,1. Remote Recruiting Workflow|2. Interview Scheduling (Global)|3. Candidate Experience (Remote)|4. ATS & CRM Data Integrity|5. Team Coordination (Remote)|6. Basic Technical Research|7. Sourcing Performance Reporting|8. Virtual Communication Etiquette,"Sourcer, Tech Recruiter, HR Assistant",3-9 Months,"LinkedIn, Calendly, Zoom"
IT Procurement Specialist (Remote Focus),Online Support,"Procurement, Remote Tech, Sourcing, Logistics",Steady Growth (+10%),Low,Focus on the procurement of IT hardware and software specifically for a distributed remote workforce.,1. Remote Hardware Sourcing|2. SaaS License Management|3. Global Shipping & Logistics|4. Remote MDM Procurement|5. Vendor Management (Remote)|6. Cost Optimization for Remote|7. Procurement Data Analytics|8. Stakeholder Need Analysis,"IT Asset Manager, Procurement Lead, Buyer",12-24 Months,"Oracle, NetSuite, Fedex Dashboards"
Technical Virtual Assistant (SEO Focus),Online Services,"SEO, Analytics, WordPress, Content, HTML",Steady (+12%),Low,"A VA who focuses on the technical execution of SEO: site audits, redirect management, and meta-data updates.",1. Technical SEO Foundations|2. SEO Audit Tooling (Ahrefs)|3. Redirect & Sitemap Management|4. WP SEO Plugin Mastery|5. Metadata & Alt-text Entry|6. Site Speed Monitoring|7. SEO Data Reporting (Looker)|8. Competitive Keyword Research,"SEO Specialist, Web Admin, Content Strategist",12-18 Months,"Ahrefs, Google Search Console, WordPress"
Technical Support Representative (Bilingual),Online Support,"Languages, Troubleshooting, Communication, Ticketing",High Niche Demand (+15%),Low,"Provide technical support in two or more languages, requiring technical literacy in both.",1. Multi-language Tech Discovery|2. Technical Translation Basics|3. Global OS Troubleshooting|4. Cultural Nuance in Support|5. Multi-language Documentation|6. Fast Switching between Chats|7. Global Escalation Workflows|8. Language Quality Validation,"Support L2, Localization Tech, Language Lead",6-12 Months,"Zendesk, Transifex, TeamViewer"
Technical Virtual Assistant (Email Tech),Online Services,"Email, DNS, Deliverability, Automation, CRM",High Growth (+18%),Low,"Specialized VA role focusing on email deliverability, DNS settings (SPF/DKIM), and automation warm-ups.",1. Email Infrastructure Basics|2. DNS Configuration (SPF/DKIM/DMARC)|3. Email Deliverability Monitoring|4. IP Warm-up Strategies|5. ESP Platform Mastery|6. Automated Sequence Logic|7. Email List Cleaning Tech|8. Deliverability Reporting Flow,"Marketing Ops, Tech Support, Web Admin",12-18 Months,"Mailchimp, SendGrid, GlockApps"
Remote Application Support (Fintech),Online Support,"Fintech, SQL, Security, Troubleshooting",High Growth (+20%),High,"Provide technical support for financial software, requiring knowledge of transaction logs and high security.",1. Fintech Ecosystem Security|2. Transaction Log Investigation|3. SQL for Financial Records|4. Payment API Troubleshooting|5. Regulatory Compliance Basics|6. Data Privacy (PCI) Standards|7. High-stakes Crisis Management|8. Secure Handoff Protocols,"Backend Dev, Security Analyst, Support L3",18-30 Months,"SQL, Splunk, Postman, Jira"
Technical Sourcing Associate (QA focus),Online Services,"Sourcing, QA Skills, Technical Mapping",Growing (+12%),Low,Focus on finding and mapping talent in the QA and software testing space.,1. QA Domain Sourcing Logic|2. Automated Test Tool Search|3. Candidate Technical Profiling|4. Testing Community Mapping|5. Diversity QA Sourcing|6. Sourcing Data Hygiene|7. Outreach for QA Roles|8. Market Skill Availability Research,"Sourcer, Tech Recruiter, HR Assistant",6-12 Months,"LinkedIn, GitHub, Gem"
Technical Support Specialist (IoT focus),Online Support,"IoT, Networking, Sensors, Troubleshooting",High Growth (+22%),Medium,"Support customers with connected devices, dealing with connectivity, firmware updates, and sensor errors.",1. IoT Architecture Basics|2. Wireless Protocol Debugging|3. Firmware Update Procedures|4. Sensor Calibration Support|5. Network Connectivity Triage|6. IoT Mobile App Syncing|7. Hardware Failure Identification|8. IoT Security Best Practices,"IoT Architect, Support L2, Hardware Tech",12-24 Months,"Arduino, Wireshark, Postman"
Remote Software Implementation Lead,Online Support,"Implementation, Leadership, Client Management",Steady (+12%),Medium,"Manage the overall technical implementation strategy for major clients, leading a team of specialists.",1. Enterprise Implementation Strat|2. Client Relationship Leadership|3. Resource Planning for Projects|4. High-level Solution Design|5. Risk Mitigation in Deployment|6. Strategic Product Alignment|7. Project Financial Tracking|8. Implementation Process Design,"Implementation Dir, Project Manager, CSM",24-48 Months,"Jira, Salesforce, Excel, Zoom"
Technical Virtual Assistant (App Support),Online Support,"Mobile Apps, Troubleshooting, App Stores, Testing",Steady (+10%),Low,"Support mobile app developers by handling user bug reports, app store reviews, and basic device testing.",1. Mobile App Lifecycle Basics|2. App Store Review Management|3. Bug Capture & Formatting|4. Basic Device Testing Flow|5. Knowledge Base Maintenance|6. User Feedback Collection|7. Mobile OS Update Impacts|8. App Beta Program Assistance,"QA, Product Manager, Support L1",12-18 Months,"App Store Connect, TestFlight, Jira"
CRM Technical Support Lead,Online Support,"Leadership, CRM, Troubleshooting, Process",High Growth (+18%),Medium,"Manage the technical support team for a CRM product, focusing on integration strategy and team metrics.",1. CRM Support Strategy|2. Team Leadership & Coaching|3. Integration Escalation Mgmt|4. Support Metric Analytics|5. Product Feedback Consolidation|6. Strategic Support Planning|7. Cross-functional Bug Triage|8. CRM Technology Roadmapping,"Support Manager, CRM Admin, Product Manager",36-60 Months,"Salesforce, Zendesk, Jira, SQL"
Technical Support Representative (Hardware focus),Online Support,"Hardware, Troubleshooting, Logistics, Ticketing",Stable (+8%),Low,"Provide remote support for hardware products, focusing on diagnosing failures and managing the RMA process.",1. Component Failure Diagnosis|2. Remote Hardware Debugging|3. RMA & Logistics Workflows|4. Hardware Lifecycle Awareness|5. Technical Discovery Questions|6. Firmware/Driver Updates|7. Replacement Part Identification|8. Support Asset Tracking,"Hardware Tech, Support L2, Logistics Manager",6-12 Months,"Zendesk, ERP Systems, Command Line"
SaaS Technical Success Architect,Online Support,"Solution Design, SaaS, Strategy, Relationship",High Growth (+20%),High,A technical architect dedicated to helping existing SaaS customers design complex integrations and workflows.,1. SaaS Enterprise Architecture|2. Advanced Workflow Automation|3. Technical Consultative Selling|4. High-level API Integration|5. System Health & ROI Audit|6. Strategic Success Roadmapping|7. Technical Advocacy (Customer)|8. Executive Relationship Mgmt,"Solutions Architect, CTO, Product Manager",36-60 Months,"Lucidchart, Postman, Salesforce"
Cloud Migration Technical Support Lead,Online Support,"Leadership, Cloud, Migration, Strategy",High Demand (+25%),High,Manage a team of engineers providing technical support for large-scale enterprise cloud migrations.,1. Enterprise Migration Strategy|2. Team Leadership & Support|3. Migration Risk Management|4. Advanced Cloud Troubleshooting|5. Stakeholder Communication|6. Resource Planning (Cloud Eng)|7. Migration Outcome Analytics|8. Strategic Cloud Vision,"Cloud Architect, Solutions Architect, IT Dir",36-60 Months,"AWS, Azure, Jira, MS Project"
Technical Sourcing Associate (Mobile focus),Online Services,"Sourcing, Mobile Skills, Technical Mapping",Steady (+12%),Low,Focus on finding and mapping talent in the mobile application development space (iOS/Android).,1. Mobile Domain Sourcing Logic|2. App Platform Keyword Search|3. Candidate Technical Profiling|4. Mobile Community Mapping|5. Diversity Mobile Sourcing|6. Sourcing Data Hygiene|7. Outreach for Mobile Roles|8. Market Skill Availability Research,"Sourcer, Tech Recruiter, HR Assistant",6-12 Months,"LinkedIn, GitHub, Gem"
Remote IT Help Desk (SME Focus),Online Support,"Product Mastery, IT Support, Troubleshooting",Steady (+10%),Medium,A help desk role focusing on being the subject matter expert for a specific corporate software suite.,1. Software Suite Mastery|2. Advanced User Troubleshooting|3. IT Policy Implementation|4. Knowledge Base Management|5. Technical Training Delivery|6. SME Incident Management|7. Support Process Improvement|8. Stakeholder Technical Support,"Systems Admin, Support Manager, IT Analyst",12-24 Months,"ServiceNow, Notion, Zoom"
Technical Virtual Assistant (Social Analytics),Online Services,"Analytics, Social Tech, Data, Reporting",Growing (+15%),Low,"A VA focusing on the data side of social media: building reports, tracking engagement, and API syncs.",1. Social Data Interpretation|2. Tracking Pixel Configuration|3. UTM Management Basics|4. Social API Connection Monitoring|5. Dashboard Design (Looker/Excel)|6. Accuracy Validation for Social|7. Monthly Performance Reporting|8. Insight Generation Basics,"Marketing Ops, Data Analyst, Social Lead",12-18 Months,"Google Data Studio, SQL, Excel"
SaaS Implementation Support Specialist,Online Support,"Implementation, SaaS, Configuration, Support",Steady (+12%),Low,Help SaaS customers with the technical configuration and initial setup of their accounts.,1. SaaS Setup Frameworks|2. Data Import & Mapping|3. Initial Configuration Setup|4. Customer Training Basics|5. Integration Connection Tests|6. Implementation Bug Triage|7. Product Education Foundations|8. Handoff to Support Support,"Implementation Lead, CS Manager, Support",6-12 Months,"Excel, Zoom, Slack"
Technical Recruiter (Data Science focus),Online Services,"Data Science Literacy, Sourcing, Screening",High Growth (+18%),Low,"Specialize in hiring Data Scientists and Analysts, requiring knowledge of statistics and ML tools.",1. Data Science Role Mapping|2. ML Tool Keyword Sourcing|3. Screening Statistical Skills|4. Data Process Literacy|5. Market Compensation for Data|6. Talent Pipeline Management|7. Sourcing Analytics|8. Onboarding Data Teams,"Tech Recruiter, HR Lead, Talent Lead",6-12 Months,"LinkedIn, Kaggle, GitHub"
Hardware Technical Sales,Hardware,"Technical Literacy, CRM, Strategy, Communication",Steady Growth (+12%),Low,Help sell specialized hardware components by explaining deep technical specifications and integration benefits.,1. Product Technical Deep-dive|2. Hardware Ecosystem Knowledge|3. Consultative Technical Selling|4. Whiteboarding Solution Design|5. Stakeholder Technical Mapping|6. ROI & Performance Analytics|7. Post-sale Technical Handoff|8. Market Trend Forecasting,"FAE, Product Manager, Account Exec",12-18 Months,"Salesforce, LinkedIn, Excel"
